o_orderkey|o_custkey|o_orderstatus|o_totalprice|o_orderdate|o_orderpriority|o_clerk|o_shippriority|o_comment|l_orderkey|l_partkey|l_suppkey|l_linenumber|l_quantity|l_extendedprice|l_discount|l_tax|l_returnflag|l_linestatus|l_shipdate|l_commitdate|l_receiptdate|l_shipinstruct|l_shipmode|l_comment
302439|284|O|121635.55|1995-09-07|3-MEDIUM|Clerk#000000022|0|blithely among the final, even theodolites. slyly slow theod|302439|10813|814|1|27.00|46542.87|0.05|0.07|N|O|1995-10-04|1995-10-14|1995-10-20|TAKE BACK RETURN|AIR|structions beside the excuses han
302886|14419|O|176391.19|1995-07-29|1-URGENT|Clerk#000000473|0|nto beans sleep. fluffily pending deposits wake fu|302886|17230|32|2|24.00|27533.52|0.02|0.08|N|O|1995-08-31|1995-09-17|1995-09-30|DELIVER IN PERSON|RAIL| haggle quickly slowly even theodol
302912|3076|P|280190.33|1995-03-17|3-MEDIUM|Clerk#000000592|0|y express instructions. furiously even dolphins after the enticingly fin|302912|2865|866|6|10.00|17678.60|0.04|0.00|A|F|1995-05-09|1995-05-27|1995-06-03|NONE|AIR| the final requests integ
303075|4270|F|152400.98|1995-02-21|1-URGENT|Clerk#000000994|0| across the furiously special asymptotes use blithel|303075|12909|172|2|35.00|63766.50|0.02|0.07|A|F|1995-05-15|1995-05-17|1995-05-29|NONE|AIR|al deposits affix blithely spec
303170|12271|O|117066.25|1995-06-08|4-NOT SPECIFIED|Clerk#000000856|0|tes haggle pinto beans. pearls wake after the furiously silent|303170|1639|393|1|16.00|24650.08|0.03|0.06|N|O|1995-08-06|1995-08-19|1995-09-02|TAKE BACK RETURN|RAIL|posits nag quickly. pinto beans cajole
303328|13406|O|167573.23|1995-07-02|4-NOT SPECIFIED|Clerk#000000717|0|sts cajole furiously. |303328|5319|575|1|24.00|29383.44|0.10|0.05|N|O|1995-09-10|1995-09-17|1995-10-10|TAKE BACK RETURN|AIR|odolites. unusual deposits was carefully
303366|8122|O|104671.38|1995-09-29|5-LOW|Clerk#000000523|0|unusual packages cajole after the pinto bean|303366|17708|510|3|40.00|65028.00|0.07|0.07|N|O|1995-11-01|1995-11-15|1995-11-19|NONE|AIR|elets nod blithely. bravely regular theo
303911|1165|O|139115.54|1995-06-26|2-HIGH|Clerk#000000918|0|final excuses cajole quickly. blithely brave asymptotes|303911|418|669|4|3.00|3955.23|0.06|0.05|N|O|1995-09-12|1995-09-21|1995-10-08|DELIVER IN PERSON|RAIL|uests across the slyly ironic requests 
303937|11665|P|247076.83|1995-03-24|5-LOW|Clerk#000000086|0|gular foxes cajole fur|303937|17377|912|7|43.00|55657.91|0.00|0.03|N|F|1995-06-06|1995-06-08|1995-06-30|NONE|RAIL|sly final foxes. slo
304101|1685|F|224342.53|1994-10-13|2-HIGH|Clerk#000000228|0|r excuses. special requests mold quickly. f|304101|5695|206|1|47.00|75232.43|0.09|0.05|R|F|1994-12-17|1995-01-01|1995-01-12|NONE|AIR|t carefully. blithely b
304225|6200|O|268230.73|1995-08-17|2-HIGH|Clerk#000000089|0| pending requests sleep quickly attainments. carefully|304225|4400|655|1|32.00|41740.80|0.10|0.06|N|O|1995-11-04|1995-11-12|1995-12-02|COLLECT COD|AIR|blithely regular packages haggle
304483|10480|O|206579.25|1995-09-16|5-LOW|Clerk#000000482|0|uriously regular packages affix across the sometimes ironic decoy|304483|14077|342|1|26.00|25767.82|0.04|0.03|N|O|1995-10-14|1995-10-27|1995-11-13|COLLECT COD|RAIL|. blithely
304484|158|F|231620.76|1995-01-03|3-MEDIUM|Clerk#000000371|0|ar sheaves. regular, pending packages boost slyly bold theodolites. furiously |304484|15605|871|1|35.00|53221.00|0.08|0.04|A|F|1995-02-27|1995-03-13|1995-03-16|COLLECT COD|AIR| ironic courts. qui
304581|14185|O|148154.13|1995-06-29|5-LOW|Clerk#000000412|0|unusual deposits-- carefully regular acc|304581|10039|820|4|7.00|6643.21|0.07|0.00|N|O|1995-07-27|1995-08-05|1995-08-08|TAKE BACK RETURN|RAIL| ideas. carefully regula
304613|118|O|318952.60|1995-09-30|3-MEDIUM|Clerk#000000583|0|. express, careful epitaphs would ha|304613|10487|488|1|34.00|47514.32|0.04|0.06|N|O|1995-11-04|1995-11-05|1995-11-29|TAKE BACK RETURN|AIR|ites. deposits sleep furiously above t
304741|12601|O|205717.60|1995-09-10|5-LOW|Clerk#000000169|0| express packages alongside of the unusual idea|304741|15800|801|5|11.00|18873.80|0.01|0.02|N|O|1995-10-17|1995-10-28|1995-11-10|NONE|RAIL|ermanently
304803|8339|O|189184.03|1995-10-03|2-HIGH|Clerk#000000110|0|lyly. furiously ironic dep|304803|12861|124|1|23.00|40798.78|0.10|0.05|N|O|1995-11-13|1995-11-22|1995-11-28|NONE|AIR|nd the blithely final depend
304897|6907|O|28171.36|1995-10-25|2-HIGH|Clerk#000000140|0|r dependencies doubt quickly quickly special dep|304897|3878|132|1|17.00|30291.79|0.07|0.00|N|O|1995-12-09|1995-12-24|1996-01-07|COLLECT COD|AIR|rnis. quickly bold requests wake f
305126|12514|F|199799.92|1994-10-30|1-URGENT|Clerk#000000438|0| alongside of the furiously special pinto beans. special excuses haggle |305126|1588|840|1|20.00|29791.60|0.08|0.05|R|F|1995-01-02|1995-01-04|1995-01-20|DELIVER IN PERSON|RAIL|e slyly after the furiousl
305219|298|F|75238.84|1994-10-27|5-LOW|Clerk#000000680|0| blithely brave instructions boost blithely. sl|305219|16196|995|1|28.00|31141.32|0.07|0.07|R|F|1994-12-30|1995-01-11|1995-01-22|NONE|AIR|ests wake blithely among the un
305312|2671|O|74467.88|1995-06-29|1-URGENT|Clerk#000000249|0|lly regular packages haggle carefully regular, fina|305312|3637|891|1|48.00|73950.24|0.05|0.06|N|O|1995-07-18|1995-08-07|1995-08-08|NONE|RAIL|y unusual hockey play
305314|6347|F|270465.36|1994-12-17|1-URGENT|Clerk#000000078|0|unusual pinto beans. slyly ironic requests wa|305314|17285|553|3|3.00|3606.84|0.05|0.05|A|F|1995-02-27|1995-03-02|1995-03-25|COLLECT COD|RAIL|are alongside of the quickly f
305447|13310|O|204681.72|1995-06-23|5-LOW|Clerk#000000931|0|ccounts wake busily above the slyly reg|305447|2770|771|2|10.00|16727.70|0.01|0.07|N|O|1995-07-12|1995-07-24|1995-07-30|NONE|RAIL|st haggle carefully above the ev
305542|6226|F|192787.94|1995-01-08|4-NOT SPECIFIED|Clerk#000000770|0| slyly sly pinto beans. even multipl|305542|3150|910|5|21.00|22116.15|0.04|0.03|R|F|1995-02-01|1995-02-08|1995-02-22|TAKE BACK RETURN|RAIL|iously even request
305573|11326|O|285331.39|1995-07-05|3-MEDIUM|Clerk#000000002|0|express requests after the carefully regular theodolites cajole|305573|9132|651|5|38.00|39562.94|0.10|0.06|N|O|1995-08-01|1995-08-14|1995-08-30|COLLECT COD|RAIL| silent instructions sleep. regula
305603|316|O|203055.84|1995-08-07|1-URGENT|Clerk#000000765|0|uickly blithely final reques|305603|11856|640|3|8.00|14142.80|0.04|0.06|N|O|1995-09-24|1995-09-30|1995-10-01|COLLECT COD|RAIL|ously stealthy
305828|9994|P|230922.39|1995-03-18|3-MEDIUM|Clerk#000000469|0|ual deposits. ironic accounts boost sl|305828|17408|409|3|32.00|42412.80|0.10|0.03|A|F|1995-04-28|1995-05-12|1995-05-21|COLLECT COD|RAIL| express plate
305858|12052|O|55934.09|1995-09-30|1-URGENT|Clerk#000000165|0|carefully. excuses integrate fluffily a|305858|17816|84|1|33.00|57215.73|0.06|0.04|N|O|1995-12-07|1995-12-21|1995-12-28|NONE|RAIL|heodolites integrate furiously qui
305988|706|O|187000.96|1995-10-10|4-NOT SPECIFIED|Clerk#000000254|0|ess asymptotes haggle across the blithely ironic request|305988|7910|911|1|36.00|65444.76|0.09|0.06|N|O|1995-12-08|1995-12-09|1996-01-04|COLLECT COD|RAIL|kly slow ac
306016|3889|F|126045.39|1994-11-16|4-NOT SPECIFIED|Clerk#000000655|0|scapades wake above the express instructions. regular, p|306016|1128|380|1|28.00|28815.36|0.10|0.06|R|F|1994-12-20|1995-01-06|1995-01-13|TAKE BACK RETURN|RAIL|onic theodolites gro
306658|1529|O|145704.84|1995-08-22|2-HIGH|Clerk#000000189|0| above the blithely final d|306658|15600|866|2|30.00|45468.00|0.05|0.05|N|O|1995-11-03|1995-11-19|1995-11-27|NONE|RAIL|blithely silent
306980|421|O|313513.46|1995-08-08|4-NOT SPECIFIED|Clerk#000000532|0| final packages boost furiously quietly special deposits. furiously regular|306980|3754|755|7|31.00|51390.25|0.00|0.07|N|O|1995-09-20|1995-09-22|1995-09-29|COLLECT COD|RAIL|ly. final, unusu
307330|6205|O|323515.38|1995-10-31|5-LOW|Clerk#000000372|0|ding to the regular, regular deposit|307330|1079|80|5|27.00|26461.89|0.00|0.00|N|O|1995-12-15|1995-12-20|1995-12-23|TAKE BACK RETURN|AIR| the express, unusual 
307330|6205|O|323515.38|1995-10-31|5-LOW|Clerk#000000372|0|ding to the regular, regular deposit|307330|3464|971|6|44.00|60168.24|0.02|0.04|N|O|1995-11-17|1995-12-09|1995-12-14|TAKE BACK RETURN|RAIL|ding requests at 
307975|7603|O|162215.46|1995-08-18|1-URGENT|Clerk#000000134|0|final accounts. slyly special|307975|13060|61|5|32.00|31137.92|0.06|0.05|N|O|1995-11-03|1995-11-04|1995-11-18|COLLECT COD|RAIL|packages wake care
308293|7786|F|193939.56|1995-01-08|1-URGENT|Clerk#000000716|0|ests haggle furiously. carefully ironi|308293|18032|301|5|26.00|24700.78|0.08|0.01|A|F|1995-03-18|1995-04-02|1995-04-05|TAKE BACK RETURN|RAIL|blithely final
308644|6763|F|271684.13|1994-11-12|4-NOT SPECIFIED|Clerk#000000121|0|ck notornis mold ab|308644|11322|584|3|43.00|53032.76|0.00|0.00|A|F|1995-02-06|1995-02-07|1995-02-12|TAKE BACK RETURN|RAIL|its use. furiously pe
309120|14881|O|56965.01|1995-07-03|3-MEDIUM|Clerk#000000239|0|the accounts wake blithely against the idly ironic dependencies; slyl|309120|2740|497|2|6.00|9856.44|0.02|0.05|N|O|1995-08-20|1995-09-02|1995-09-13|DELIVER IN PERSON|RAIL|en accounts sleep across the final the
309443|4900|O|126879.60|1995-06-10|4-NOT SPECIFIED|Clerk#000000497|0|uriously unusual requests beyond the theodolites sublat|309443|16745|746|4|30.00|49852.20|0.08|0.00|N|O|1995-07-15|1995-07-22|1995-07-25|TAKE BACK RETURN|RAIL|c pinto beans. blithely
309444|4933|F|101595.08|1995-02-12|1-URGENT|Clerk#000000885|0|ackages. packages sleep ironic accounts. regular platelets x-|309444|13025|289|4|22.00|20636.44|0.04|0.00|R|F|1995-04-14|1995-04-16|1995-04-27|TAKE BACK RETURN|AIR| the carefully ironic pa
309507|4417|P|305457.52|1995-04-14|3-MEDIUM|Clerk#000000981|0|platelets sleep blithely after the regu|309507|6772|773|3|42.00|70508.34|0.06|0.02|A|F|1995-05-02|1995-05-19|1995-05-22|TAKE BACK RETURN|AIR|ar realms 
309667|14554|F|178384.59|1994-11-16|3-MEDIUM|Clerk#000000913|0| carefully final asymptotes among the furiously ironic pinto beans c|309667|7459|974|3|41.00|56024.45|0.01|0.05|A|F|1995-01-19|1995-02-03|1995-02-16|TAKE BACK RETURN|AIR|olites sleep slyly even accounts. ironic fo
309797|4108|F|197447.32|1994-11-12|3-MEDIUM|Clerk#000000891|0|after the unusual accounts: carefully regular excuses main|309797|3250|757|3|16.00|18452.00|0.06|0.02|A|F|1995-02-05|1995-02-08|1995-02-25|DELIVER IN PERSON|AIR|s haggle ca
309797|4108|F|197447.32|1994-11-12|3-MEDIUM|Clerk#000000891|0|after the unusual accounts: carefully regular excuses main|309797|19475|745|6|39.00|54384.33|0.00|0.02|A|F|1995-01-15|1995-01-23|1995-02-04|TAKE BACK RETURN|AIR|s are blithely requests. regular dep
309889|12355|O|257867.19|1995-05-29|5-LOW|Clerk#000000528|0|y final accounts. slyly regular p|309889|11919|703|4|19.00|34787.29|0.03|0.04|N|O|1995-07-08|1995-07-26|1995-08-05|DELIVER IN PERSON|AIR|eans sleep fluffily regularly ex
310242|58|O|95273.04|1995-06-27|1-URGENT|Clerk#000000634|0|regular accounts. quickly silent acco|310242|15191|722|1|50.00|55309.50|0.03|0.04|N|O|1995-08-04|1995-08-19|1995-08-24|COLLECT COD|RAIL|kages maint
310305|14474|F|241193.46|1995-02-09|2-HIGH|Clerk#000000386|0|ly regular theodolites use carefully deposits. blithely final pi|310305|10803|804|2|24.00|41131.20|0.09|0.06|A|F|1995-04-25|1995-04-29|1995-05-17|NONE|RAIL| requests are pinto beans. furiously ironic
310631|11446|O|112641.66|1995-06-11|5-LOW|Clerk#000000209|0|usly regular accounts use fl|310631|9245|23|1|17.00|19622.08|0.08|0.04|N|O|1995-06-30|1995-07-11|1995-07-19|COLLECT COD|AIR|ld, thin ac
310817|14767|F|50698.28|1995-02-22|5-LOW|Clerk#000000154|0|carefully unusual foxes wake carefully! slyly ironic requ|310817|16346|879|3|24.00|30296.16|0.09|0.06|A|F|1995-04-24|1995-04-26|1995-05-18|COLLECT COD|AIR|o the requests. pending excuses boost caref
311047|7555|F|47384.11|1994-12-06|5-LOW|Clerk#000000571|0|ross the ironic accounts. furiously |311047|16582|583|2|3.00|4495.74|0.09|0.03|A|F|1995-01-13|1995-02-02|1995-02-07|TAKE BACK RETURN|RAIL|grate blithely blithely even reques
311200|5848|O|232523.51|1995-07-23|5-LOW|Clerk#000000928|0|cajole blithely of the permanently final theodolites. blithely careful theo|311200|5848|849|1|45.00|78922.80|0.03|0.03|N|O|1995-09-06|1995-09-26|1995-09-30|TAKE BACK RETURN|RAIL|s unwind furiously r
311266|13534|F|336766.01|1995-02-17|2-HIGH|Clerk#000000561|0|ounts cajole beside the evenly final deposits; fluffily|311266|15500|31|7|5.00|7077.50|0.08|0.02|R|F|1995-03-29|1995-04-06|1995-04-26|TAKE BACK RETURN|AIR|. final courts imp
311968|11806|F|138058.88|1995-01-09|4-NOT SPECIFIED|Clerk#000000198|0| after the ironic, ironic accounts. even asymptotes before the |311968|5261|772|2|18.00|20992.68|0.10|0.08|R|F|1995-02-28|1995-03-11|1995-03-15|NONE|RAIL|ly after the car
311968|11806|F|138058.88|1995-01-09|4-NOT SPECIFIED|Clerk#000000198|0| after the ironic, ironic accounts. even asymptotes before the |311968|18033|34|5|22.00|20922.66|0.07|0.02|R|F|1995-02-24|1995-03-04|1995-03-05|COLLECT COD|AIR|al accounts. blithely even
312161|13049|O|279454.22|1995-07-06|5-LOW|Clerk#000000614|0| silent deposits affix above the furiously silent theodolites. furiously regul|312161|2802|803|3|38.00|64782.40|0.08|0.00|N|O|1995-08-17|1995-08-18|1995-09-07|NONE|RAIL|dolites: sl
312230|6058|O|150222.59|1995-08-30|3-MEDIUM|Clerk#000000493|0|sly unusual instructions nag furiously depos|312230|182|683|1|32.00|34629.76|0.03|0.08|N|O|1995-10-12|1995-10-19|1995-10-28|DELIVER IN PERSON|RAIL| according to the asymptotes. quickl
312417|5800|O|127782.01|1995-07-17|5-LOW|Clerk#000000808|0| requests affix carefully. |312417|3781|288|5|30.00|50543.40|0.05|0.08|N|O|1995-08-07|1995-08-19|1995-08-28|TAKE BACK RETURN|AIR|ffily across the carefully final 
312486|7240|O|109480.92|1995-07-30|5-LOW|Clerk#000000507|0|lyly. regular platelets integrate about the ca|312486|645|396|3|33.00|51006.12|0.10|0.05|N|O|1995-09-06|1995-09-23|1995-09-25|TAKE BACK RETURN|AIR|xcuses boost furiously. 
312610|11176|O|150556.56|1995-09-02|1-URGENT|Clerk#000000007|0|s around the slyly even d|312610|16096|895|2|45.00|45544.05|0.06|0.05|N|O|1995-10-30|1995-11-04|1995-11-10|TAKE BACK RETURN|RAIL| bold instructio
312614|9470|F|184374.96|1994-10-30|1-URGENT|Clerk#000000225|0|ts detect above the express pinto beans. furiously|312614|6386|643|4|29.00|37479.02|0.02|0.00|R|F|1994-12-30|1995-01-08|1995-01-13|COLLECT COD|AIR|s requests. ironic fo
312641|5450|F|63854.31|1994-12-07|1-URGENT|Clerk#000000358|0|y regular theodolites hinder unusual deposi|312641|16309|310|1|41.00|50237.30|0.04|0.08|A|F|1995-02-05|1995-02-13|1995-03-07|TAKE BACK RETURN|AIR|ckly along t
312643|100|P|121069.43|1995-05-09|4-NOT SPECIFIED|Clerk#000000337|0|the furiously pending r|312643|11357|619|2|18.00|22830.30|0.02|0.01|N|O|1995-07-14|1995-07-17|1995-07-25|DELIVER IN PERSON|RAIL|ges wake slyly foxes. blithely re
313092|3559|O|155007.32|1995-08-23|2-HIGH|Clerk#000000992|0|gular foxes haggle fluffil|313092|3689|943|1|28.00|44595.04|0.06|0.06|N|O|1995-10-03|1995-10-13|1995-10-28|TAKE BACK RETURN|AIR|gainst the quickly final accou
313541|11191|P|235246.42|1995-05-21|5-LOW|Clerk#000000583|0|riously against the blithely pending ideas. slyly final de|313541|1818|572|4|37.00|63632.97|0.06|0.01|N|O|1995-07-19|1995-07-21|1995-08-03|TAKE BACK RETURN|RAIL| the silent, final accou
313634|2627|P|102493.08|1995-04-28|1-URGENT|Clerk#000000714|0|gular instructions across the f|313634|2867|372|4|38.00|67254.68|0.06|0.01|N|F|1995-06-13|1995-06-30|1995-07-06|DELIVER IN PERSON|AIR|oss the blithely ironic accounts. regular
313889|1975|F|312463.84|1994-10-24|2-HIGH|Clerk#000000024|0|ly evenly silent gifts! pending instructions haggle |313889|2558|63|4|39.00|56961.45|0.03|0.01|R|F|1995-01-03|1995-01-14|1995-02-02|COLLECT COD|RAIL|s wake slyly fi
313952|11878|O|216616.73|1995-09-06|3-MEDIUM|Clerk#000000758|0|sly packages integrate blithely regular forge|313952|10867|868|3|27.00|48002.22|0.00|0.00|N|O|1995-09-16|1995-10-06|1995-10-10|DELIVER IN PERSON|AIR|sh slyly after the sly
314373|5194|O|275385.08|1995-09-06|4-NOT SPECIFIED|Clerk#000000903|0|quickly bold pinto beans. carefully final accounts above the idle|314373|2753|258|2|40.00|66230.00|0.07|0.01|N|O|1995-11-10|1995-11-15|1995-12-04|NONE|AIR|side of the furiously silent accou
314496|5369|F|301002.72|1994-12-06|5-LOW|Clerk#000000951|0|sits. quickly regular deposits boost|314496|18441|442|1|5.00|6797.20|0.02|0.03|R|F|1995-01-15|1995-01-19|1995-01-29|TAKE BACK RETURN|RAIL|e ironic p
314528|10346|F|265097.95|1995-02-08|4-NOT SPECIFIED|Clerk#000000168|0|ing, silent deposits sleep slyly aga|314528|8420|421|6|35.00|46494.70|0.04|0.06|R|F|1995-03-08|1995-03-30|1995-04-04|TAKE BACK RETURN|RAIL| somas. carefully pending platelets sle
314594|2698|P|58642.24|1995-05-01|5-LOW|Clerk#000000720|0|pinto beans are blithely. quickly unus|314594|2812|813|4|6.00|10288.86|0.00|0.08|N|F|1995-06-01|1995-06-23|1995-06-25|DELIVER IN PERSON|RAIL| finally unusual excuses. regular dino
314627|1540|P|171510.24|1995-04-07|5-LOW|Clerk#000000140|0|t carefully. regularly bold depen|314627|7256|514|3|7.00|8142.75|0.02|0.08|N|O|1995-06-22|1995-06-23|1995-07-02|DELIVER IN PERSON|AIR|even accounts 
314629|11777|F|211765.06|1994-11-05|4-NOT SPECIFIED|Clerk#000000636|0|ilent foxes after the accounts are about the co|314629|15468|734|3|2.00|2766.92|0.01|0.02|A|F|1995-01-15|1995-01-21|1995-02-02|DELIVER IN PERSON|AIR| instructions. sly
314630|9770|P|188324.04|1995-04-29|4-NOT SPECIFIED|Clerk#000000989|0|lites nag blithely. fluffily slo|314630|7090|348|5|13.00|12962.17|0.02|0.03|N|F|1995-05-28|1995-06-11|1995-06-20|NONE|RAIL|yly careful theodolites. asymptotes nag qui
314663|11998|O|270220.70|1995-10-05|1-URGENT|Clerk#000000770|0|ss packages. boldly final deposits haggle blithely. blit|314663|4461|224|1|44.00|60080.24|0.08|0.05|N|O|1995-12-17|1995-12-29|1996-01-08|TAKE BACK RETURN|AIR|fter the quickly
314723|9875|F|145894.00|1995-01-25|4-NOT SPECIFIED|Clerk#000000830|0|iously regular pinto beans. f|314723|16977|776|3|48.00|90910.56|0.07|0.01|A|F|1995-04-08|1995-04-22|1995-05-04|NONE|AIR|osits promise bl
314944|2086|F|138138.62|1995-03-13|5-LOW|Clerk#000000052|0|cial ideas. fluffily pending requests sleep |314944|12535|322|5|8.00|11580.24|0.10|0.04|N|F|1995-06-06|1995-06-10|1995-06-30|COLLECT COD|RAIL|instructions use s
314944|2086|F|138138.62|1995-03-13|5-LOW|Clerk#000000052|0|cial ideas. fluffily pending requests sleep |314944|2292|545|6|10.00|11942.90|0.08|0.08|A|F|1995-04-23|1995-05-13|1995-05-21|DELIVER IN PERSON|RAIL|se deposits caj
315138|14135|O|196770.93|1995-07-01|1-URGENT|Clerk#000000193|0|ly. unusual, careful deposits boost carefully final, ironic pla|315138|12421|684|7|29.00|38669.18|0.00|0.07|N|O|1995-07-23|1995-08-03|1995-08-05|TAKE BACK RETURN|RAIL|ar accounts kindle iron
315207|12553|O|264830.91|1995-07-12|4-NOT SPECIFIED|Clerk#000000955|0|s the slyly ironic deposits. blithely silent theodo|315207|2023|528|6|21.00|19425.42|0.02|0.05|N|O|1995-08-11|1995-08-23|1995-09-09|COLLECT COD|AIR|uffily unusual theodolite
315362|841|O|150756.03|1995-07-13|2-HIGH|Clerk#000000747|0|counts. enticing, silent requests caj|315362|15603|134|3|17.00|25816.20|0.07|0.02|N|O|1995-08-10|1995-08-22|1995-08-31|COLLECT COD|AIR|grate carefully across the fluffily r
315363|14000|O|186560.51|1995-06-29|5-LOW|Clerk#000000819|0|ding deposits. carefully final dolphins across the regular|315363|621|372|1|47.00|71516.14|0.03|0.08|N|O|1995-08-01|1995-08-21|1995-08-29|TAKE BACK RETURN|RAIL|luffily bold packages 
315367|5032|P|199926.01|1995-03-26|1-URGENT|Clerk#000000295|0|bold packages sleep carefully|315367|17528|330|2|22.00|31801.44|0.03|0.06|N|F|1995-05-28|1995-06-09|1995-06-27|DELIVER IN PERSON|RAIL|ke close, bold grouches. pendi
315394|2060|O|87215.94|1995-07-16|4-NOT SPECIFIED|Clerk#000000253|0| accounts. furiously unusual dependencies caj|315394|17326|861|3|19.00|23623.08|0.05|0.02|N|O|1995-07-22|1995-08-18|1995-08-19|DELIVER IN PERSON|AIR|uffily iron
315492|23|O|203872.42|1995-07-04|5-LOW|Clerk#000000081|0|gular pinto beans wake. special, even accounts are furiously. special,|315492|17086|354|4|38.00|38117.04|0.06|0.00|N|O|1995-08-31|1995-09-12|1995-09-17|COLLECT COD|RAIL|ove the pinto beans 
315492|23|O|203872.42|1995-07-04|5-LOW|Clerk#000000081|0|gular pinto beans wake. special, even accounts are furiously. special,|315492|18035|304|6|25.00|23825.75|0.07|0.06|N|O|1995-09-04|1995-09-08|1995-09-14|COLLECT COD|RAIL|ckly even fox
315750|1480|F|221830.31|1994-11-22|1-URGENT|Clerk#000000589|0| to the quickly thin frays are closely about the |315750|15395|926|5|8.00|10483.12|0.03|0.07|R|F|1995-01-26|1995-01-27|1995-01-29|TAKE BACK RETURN|RAIL|ss the slyly final accounts. special, bo
316066|10105|O|220051.45|1995-08-14|3-MEDIUM|Clerk#000000161|0|riously final deposits. ironic, bold requests poach carefully unusual fo|316066|6603|372|4|13.00|19624.80|0.03|0.05|N|O|1995-09-16|1995-10-04|1995-10-05|COLLECT COD|AIR|ions promise quickly ironi
316388|12028|O|54326.60|1995-10-05|4-NOT SPECIFIED|Clerk#000000240|0|requests are slyly. furiously even requests sleep quickly according to the sly|316388|8396|397|2|37.00|48262.43|0.09|0.01|N|O|1995-11-27|1995-11-29|1995-12-24|COLLECT COD|AIR|e slyly special deposits. pac
316420|12674|O|220295.33|1995-10-26|4-NOT SPECIFIED|Clerk#000000725|0|deas boost furiously bold platelets. regular, careful deposits cajole fluffil|316420|2315|316|1|50.00|60865.50|0.05|0.04|N|O|1995-11-27|1995-11-29|1995-12-10|COLLECT COD|AIR|tructions acr
316420|12674|O|220295.33|1995-10-26|4-NOT SPECIFIED|Clerk#000000725|0|deas boost furiously bold platelets. regular, careful deposits cajole fluffil|316420|7898|156|4|32.00|57788.48|0.10|0.08|N|O|1995-12-08|1995-12-27|1996-01-04|NONE|RAIL|tes cajole blithely bold dolphins. pinto be
316582|10249|F|180671.14|1994-11-17|3-MEDIUM|Clerk#000000073|0|ly above the ironic, regular pi|316582|17931|733|2|3.00|5546.79|0.05|0.03|R|F|1995-01-16|1995-01-21|1995-01-27|TAKE BACK RETURN|RAIL|fily express instructions haggle care
316807|11881|P|87459.82|1995-03-07|2-HIGH|Clerk#000000630|0|structions. deposits wake final packages. ironic foxes sleep slyly final pack|316807|2017|18|2|19.00|17461.19|0.09|0.03|R|F|1995-05-22|1995-06-01|1995-06-09|DELIVER IN PERSON|AIR|nding packages hagg
316899|12613|O|111543.80|1995-06-04|5-LOW|Clerk#000000829|0|ar packages: special somas haggle slyly? express excuses above t|316899|2550|55|6|3.00|4357.65|0.09|0.02|N|O|1995-08-20|1995-08-26|1995-09-18|COLLECT COD|RAIL|cajole blithely about 
317120|11638|F|98723.32|1995-02-13|5-LOW|Clerk#000000288|0| brave requests against the furiously express reques|317120|5572|828|1|9.00|13298.13|0.06|0.00|A|F|1995-03-12|1995-03-26|1995-04-06|COLLECT COD|AIR|nal requests are slyly quickly regul
317281|5383|F|194111.15|1994-09-29|1-URGENT|Clerk#000000117|0|blithely regular packages. orbits wake within the silent deposits. final,|317281|7527|299|5|16.00|22952.32|0.07|0.01|R|F|1994-12-10|1994-12-19|1995-01-09|TAKE BACK RETURN|AIR|iously express account
317316|13747|F|144154.20|1995-02-27|5-LOW|Clerk#000000872|0| final accounts-- quickly final platelets against the sometime|317316|19396|935|1|12.00|15784.68|0.07|0.07|R|F|1995-05-03|1995-05-23|1995-05-29|TAKE BACK RETURN|RAIL|ly according 
317316|13747|F|144154.20|1995-02-27|5-LOW|Clerk#000000872|0| final accounts-- quickly final platelets against the sometime|317316|16963|762|3|12.00|22559.52|0.05|0.05|R|F|1995-05-15|1995-05-25|1995-06-06|COLLECT COD|AIR|n pinto beans according to t
317542|4622|O|278498.38|1995-05-28|5-LOW|Clerk#000000242|0| slyly. slyly ironic packages after the sly|317542|5261|262|4|7.00|8163.82|0.02|0.07|N|O|1995-07-23|1995-08-03|1995-08-14|DELIVER IN PERSON|RAIL|quickly carefully pending accounts. quic
318305|13792|F|150217.87|1994-12-01|3-MEDIUM|Clerk#000000311|0|y special hockey players cajole at the fi|318305|4419|420|2|34.00|44995.94|0.05|0.08|A|F|1995-01-12|1995-01-14|1995-02-02|DELIVER IN PERSON|RAIL|ons against the furiously final 
318531|7000|O|198755.56|1995-06-25|3-MEDIUM|Clerk#000000636|0|ecial deposits after the express, even reques|318531|13775|39|4|39.00|65862.03|0.02|0.03|N|O|1995-08-01|1995-08-14|1995-08-31|NONE|RAIL| gifts. ca
318692|2522|F|190071.93|1995-02-01|1-URGENT|Clerk#000000078|0|te stealthily. thinly unusual requests hinder bravely among the regular fo|318692|18777|314|1|27.00|45785.79|0.08|0.05|R|F|1995-04-23|1995-05-02|1995-05-19|TAKE BACK RETURN|AIR|pendencies. quickly unusual requ
318692|2522|F|190071.93|1995-02-01|1-URGENT|Clerk#000000078|0|te stealthily. thinly unusual requests hinder bravely among the regular fo|318692|6588|357|3|5.00|7472.90|0.10|0.07|R|F|1995-02-26|1995-03-08|1995-03-28|DELIVER IN PERSON|RAIL|fluffily pending requests. f
318819|394|P|177456.42|1995-05-04|3-MEDIUM|Clerk#000000212|0|onic excuses according to the regular deposits haggle furiously even|318819|18069|874|2|12.00|11844.72|0.02|0.02|N|O|1995-06-28|1995-07-13|1995-07-26|COLLECT COD|AIR|st the fluffy
318884|8341|F|149048.02|1994-11-22|3-MEDIUM|Clerk#000000127|0|ts. even dinos subl|318884|6542|55|4|44.00|63735.76|0.01|0.02|R|F|1995-01-10|1995-01-22|1995-01-27|COLLECT COD|AIR|encies grow
319362|13582|P|153010.35|1995-04-18|1-URGENT|Clerk#000000067|0|ccounts around the ideas doze quickly dependencies. quickly |319362|5348|349|1|7.00|8773.38|0.09|0.01|N|F|1995-05-24|1995-06-01|1995-06-23|COLLECT COD|AIR|al accounts-- slyly specia
319457|6673|F|148001.75|1994-09-28|1-URGENT|Clerk#000000091|0| to the furiously special|319457|14849|114|5|39.00|68789.76|0.01|0.08|A|F|1994-12-05|1994-12-06|1995-01-02|DELIVER IN PERSON|RAIL| ironic, regular theodol
319520|3361|P|122607.30|1995-04-08|5-LOW|Clerk#000000714|0|odolites haggle blithely fluffily i|319520|11616|617|4|25.00|38190.25|0.00|0.06|R|F|1995-05-12|1995-05-20|1995-06-02|TAKE BACK RETURN|AIR| instructions haggle quickly blithel
