o_orderkey|o_custkey|o_orderstatus|o_totalprice|o_orderdate|o_orderpriority|o_clerk|o_shippriority|o_comment|l_orderkey|l_partkey|l_suppkey|l_linenumber|l_quantity|l_extendedprice|l_discount|l_tax|l_returnflag|l_linestatus|l_shipdate|l_commitdate|l_receiptdate|l_shipinstruct|l_shipmode|l_comment
444131|12388|O|189330.36|1995-08-03|3-MEDIUM|Clerk#000000965|0| fluffily express, regular deposits. dinos run bold, final accounts.|444131|18628|629|3|34.00|52585.08|0.10|0.01|N|O|1995-10-01|1995-10-17|1995-10-23|COLLECT COD|AIR|bout the foxe
444198|3586|F|168101.27|1994-12-29|2-HIGH|Clerk#000000437|0|warthogs according to the ironic instructions are furiously enticing ac|444198|16740|741|2|17.00|28164.58|0.00|0.00|R|F|1995-02-09|1995-02-15|1995-02-20|NONE|AIR|ickly ironic platelets snooze fluf
444291|11344|F|140945.97|1995-02-15|3-MEDIUM|Clerk#000000645|0|ic packages from the slyly even packages detect slyly even |444291|4546|547|5|1.00|1450.54|0.03|0.08|R|F|1995-04-27|1995-05-12|1995-05-22|TAKE BACK RETURN|AIR|fix furiously furiously bold sautern
444387|13609|O|116506.92|1995-06-30|5-LOW|Clerk#000000097|0|refully unusual theodoli|444387|5899|155|5|12.00|21658.68|0.10|0.01|N|O|1995-08-16|1995-08-27|1995-09-12|DELIVER IN PERSON|AIR|out the fluffily final inst
444455|11573|P|76086.27|1995-05-31|3-MEDIUM|Clerk#000000820|0|eodolites are slyly. slyly regular deposits sleep according to |444455|797|798|1|5.00|8488.95|0.05|0.01|N|O|1995-07-27|1995-07-28|1995-07-29|TAKE BACK RETURN|AIR|xpress requests. fluffily unusual 
444455|11573|P|76086.27|1995-05-31|3-MEDIUM|Clerk#000000820|0|eodolites are slyly. slyly regular deposits sleep according to |444455|11606|868|3|14.00|21246.40|0.01|0.02|N|F|1995-06-07|1995-07-06|1995-07-07|COLLECT COD|AIR|cies. unusu
444996|8912|P|266453.49|1995-04-13|2-HIGH|Clerk#000000047|0| deposits. slyly even platelets breach quickly packages. fluffi|444996|16949|748|2|44.00|82101.36|0.04|0.06|N|O|1995-06-21|1995-07-07|1995-07-08|TAKE BACK RETURN|RAIL|tes sleep slyly at the unusu
444996|8912|P|266453.49|1995-04-13|2-HIGH|Clerk#000000047|0| deposits. slyly even platelets breach quickly packages. fluffi|444996|7796|311|4|19.00|32372.01|0.07|0.00|N|O|1995-07-02|1995-07-05|1995-07-29|TAKE BACK RETURN|AIR|nding warthogs alo
445473|6733|O|181049.47|1995-06-28|2-HIGH|Clerk#000000722|0|lently even requests. bold requests sleep ir|445473|6814|327|3|18.00|30974.58|0.06|0.03|N|O|1995-08-08|1995-08-12|1995-08-22|DELIVER IN PERSON|AIR|refully unusual excuses. ironic, ir
445830|7927|F|177704.95|1994-12-08|2-HIGH|Clerk#000000651|0|longside of the quickly unusual requests print sometimes against the careful|445830|10410|191|4|39.00|51495.99|0.07|0.00|A|F|1995-02-02|1995-02-23|1995-03-01|COLLECT COD|AIR|the packages. furiously daring 
445889|3721|F|54840.89|1994-10-29|4-NOT SPECIFIED|Clerk#000000398|0|uickly even deposits. carefully special packages use packages. carefully regul|445889|981|732|1|31.00|58341.38|0.06|0.00|A|F|1994-12-26|1995-01-03|1995-01-09|DELIVER IN PERSON|RAIL|usly regular grouches engage toward the b
445924|8569|O|73102.61|1995-08-04|1-URGENT|Clerk#000000638|0|regular requests. bold, ironic instructions are-- slyly unusual sent|445924|15111|642|3|4.00|4104.44|0.05|0.03|N|O|1995-10-08|1995-10-29|1995-11-07|COLLECT COD|RAIL|nent deposits cajole qui
445986|5203|O|169206.11|1995-11-07|2-HIGH|Clerk#000000845|0|heodolites integrate furiously bold accounts. blithely silent asymptotes hagg|445986|15752|283|1|41.00|68377.75|0.06|0.04|N|O|1995-12-20|1995-12-29|1996-01-14|NONE|AIR| quick, express pinto beans was
446147|5767|P|249319.44|1995-03-04|1-URGENT|Clerk#000000381|0|the blithely ironic dolphins. furiously ironic theodol|446147|11136|659|1|37.00|38743.81|0.06|0.07|R|F|1995-04-27|1995-04-29|1995-05-16|NONE|RAIL|oze furiously slyly ironic packag
446179|14914|O|218234.25|1995-04-18|2-HIGH|Clerk#000000187|0| about the quickly even dependencies cajole furio|446179|15846|377|6|33.00|58140.72|0.10|0.06|N|O|1995-06-26|1995-07-06|1995-07-26|DELIVER IN PERSON|AIR|across the furiously unusual
446594|10564|O|252108.12|1995-10-12|3-MEDIUM|Clerk#000000874|0|ld packages. carefully eve|446594|3198|958|3|20.00|22023.80|0.01|0.06|N|O|1995-12-09|1995-12-13|1995-12-20|TAKE BACK RETURN|AIR|sly even sen
447075|10844|F|141559.39|1994-11-23|2-HIGH|Clerk#000000199|0|regular, ironic deposits after the quickly f|447075|5244|755|1|26.00|29880.24|0.07|0.01|A|F|1995-02-16|1995-02-18|1995-03-06|TAKE BACK RETURN|AIR|l packages above the furiously f
447202|475|O|125492.32|1995-08-10|4-NOT SPECIFIED|Clerk#000000542|0|ckages are according to the regular accounts|447202|7615|873|3|8.00|12180.88|0.03|0.00|N|O|1995-10-29|1995-11-02|1995-11-21|DELIVER IN PERSON|AIR| mold ideas! slyly ironic grouches hagg
447234|544|O|181712.52|1995-08-29|1-URGENT|Clerk#000000664|0|lar packages boost furiously close depos|447234|6515|284|2|41.00|58281.91|0.08|0.04|N|O|1995-10-06|1995-10-08|1995-10-29|COLLECT COD|RAIL|ly furiously regular d
447616|6439|P|246076.65|1995-05-18|4-NOT SPECIFIED|Clerk#000000495|0|ts about the fluffily regular deposits are unusual package|447616|6884|653|2|24.00|42981.12|0.07|0.04|N|O|1995-07-01|1995-07-05|1995-07-27|NONE|RAIL|e fluffily even accounts. r
447780|3115|O|219413.89|1995-09-28|5-LOW|Clerk#000000719|0|y accounts cajole blithely along the slyly ironic f|447780|9909|687|2|24.00|43653.60|0.05|0.01|N|O|1995-10-20|1995-10-28|1995-11-06|DELIVER IN PERSON|RAIL|against the fr
448103|2930|O|271326.71|1995-06-09|3-MEDIUM|Clerk#000000486|0|slyly even deposits detect furiously. idly even requests detec|448103|2363|364|4|19.00|24041.84|0.05|0.07|N|O|1995-07-21|1995-08-04|1995-08-14|NONE|AIR|ntain about the regular, even pac
448133|8038|F|183541.62|1995-01-31|4-NOT SPECIFIED|Clerk#000000610|0|the quickly pending excuses. slyly regular deposits a|448133|19071|610|6|20.00|19801.40|0.03|0.05|A|F|1995-02-24|1995-03-10|1995-03-19|NONE|RAIL|es boost slyly ideas.
448229|4315|P|315976.93|1995-03-18|3-MEDIUM|Clerk#000000125|0|tions. blithely final theodolites sleep carefully blithely bold package|448229|10758|279|1|34.00|56737.50|0.02|0.01|A|F|1995-04-08|1995-04-21|1995-05-05|DELIVER IN PERSON|AIR|special ideas haggle q
448229|4315|P|315976.93|1995-03-18|3-MEDIUM|Clerk#000000125|0|tions. blithely final theodolites sleep carefully blithely bold package|448229|10619|400|5|9.00|13766.49|0.05|0.02|A|F|1995-05-27|1995-06-07|1995-06-10|COLLECT COD|AIR|ssly final requests s
448423|1571|F|324883.91|1995-02-10|1-URGENT|Clerk#000000302|0| ironic accounts. blithely stealthy theodolit|448423|9489|267|2|49.00|68525.52|0.04|0.02|A|F|1995-03-27|1995-03-28|1995-04-03|DELIVER IN PERSON|AIR|ckages among the blithe
448647|11650|F|120121.90|1994-10-18|1-URGENT|Clerk#000000918|0|carefully among the ironic dolphins. theodolites cajole|448647|6931|932|2|30.00|55137.90|0.09|0.08|A|F|1994-12-18|1995-01-08|1995-01-14|TAKE BACK RETURN|AIR|nts impress blithely. slyly expres
448772|9742|O|240043.52|1995-07-27|5-LOW|Clerk#000000662|0|enticing pinto beans doze closely. quickly final deposits wake.|448772|11865|127|2|46.00|81735.56|0.08|0.08|N|O|1995-08-29|1995-09-01|1995-09-16|DELIVER IN PERSON|AIR|e instructions. final s
448804|8771|O|118410.84|1995-06-07|5-LOW|Clerk#000000058|0| kindle. slyly special accounts ar|448804|676|427|1|11.00|17343.37|0.04|0.01|N|O|1995-07-08|1995-07-14|1995-07-24|NONE|AIR|ns. furiously final accounts agains
448962|1166|O|216785.09|1995-10-15|2-HIGH|Clerk#000000989|0|ular packages? even courts among the furiously regular pinto beans are quickl|448962|19711|250|4|45.00|73381.95|0.00|0.04|N|O|1995-11-21|1995-12-04|1995-12-17|DELIVER IN PERSON|AIR|arefully special deposits. sometimes reg
449027|9529|F|165718.15|1995-01-08|2-HIGH|Clerk#000000316|0|after the regular dependencies-- quickly final instructions sleep cou|449027|18873|142|5|29.00|51964.23|0.06|0.02|A|F|1995-01-26|1995-02-14|1995-02-15|COLLECT COD|RAIL|ending, even instructions grow furio
449089|9026|F|15915.09|1995-03-21|1-URGENT|Clerk#000000117|0|cial dolphins haggle carefully regular re|449089|3907|161|1|9.00|16298.10|0.07|0.05|A|F|1995-05-09|1995-05-17|1995-05-23|DELIVER IN PERSON|AIR|onic ideas haggle furiou
449092|8939|O|125508.57|1995-06-20|2-HIGH|Clerk#000000889|0| requests-- blithely even packages cajole fluffily unusual, unusual dep|449092|19175|176|1|34.00|37201.78|0.06|0.00|N|O|1995-08-15|1995-08-16|1995-09-08|NONE|AIR|lyly regular dependencies. express asympt
449763|2344|P|108704.71|1995-05-09|3-MEDIUM|Clerk#000000672|0|usly special ideas across the furiously final accounts wake carefully |449763|13726|253|2|11.00|18036.92|0.01|0.07|N|O|1995-07-23|1995-07-26|1995-08-08|DELIVER IN PERSON|AIR|ven asympto
449895|8801|P|112584.14|1995-05-29|4-NOT SPECIFIED|Clerk#000000001|0|the quickly final ideas play silently ironic foxes. ironic, eve|449895|19369|908|2|5.00|6441.80|0.07|0.00|N|O|1995-06-29|1995-07-07|1995-07-11|COLLECT COD|AIR|ajole silent pinto beans
449957|1363|F|160870.95|1995-01-04|4-NOT SPECIFIED|Clerk#000000923|0|s. even, sly foxes along the idly |449957|8914|689|2|39.00|71093.49|0.01|0.07|A|F|1995-03-11|1995-03-26|1995-03-29|NONE|RAIL|the blithely ironic packages na
449986|4150|F|179975.42|1995-02-14|4-NOT SPECIFIED|Clerk#000000294|0| the blithely even instructions nag carefully even instructions. sp|449986|11955|739|3|9.00|16802.55|0.03|0.02|R|F|1995-04-18|1995-05-05|1995-05-12|NONE|RAIL|elets are blith
450407|8411|O|198347.06|1995-06-20|2-HIGH|Clerk#000000312|0|e quickly after the quickly even deposits. furiously |450407|16968|767|1|44.00|82938.24|0.08|0.03|N|O|1995-07-08|1995-07-24|1995-08-01|DELIVER IN PERSON|RAIL|ully final platelets across the f
450439|4130|O|185144.99|1995-05-28|3-MEDIUM|Clerk#000000151|0|ng to the regular foxes. ironic somas n|450439|14473|474|4|9.00|12487.23|0.10|0.06|N|O|1995-07-07|1995-07-12|1995-07-24|TAKE BACK RETURN|RAIL|ironic packages-- bold instructio
450466|11635|F|219118.82|1995-03-08|2-HIGH|Clerk#000000563|0|gular packages engage furiously.|450466|3081|841|1|32.00|31490.56|0.05|0.05|A|F|1995-04-11|1995-04-15|1995-05-02|NONE|RAIL|the ironic, regular packages. final 
450503|10399|F|96992.29|1994-11-09|3-MEDIUM|Clerk#000000189|0|g the carefully silent requests. deposits nag after the carefully |450503|1591|94|3|12.00|17911.08|0.09|0.04|R|F|1994-12-30|1995-01-06|1995-01-09|COLLECT COD|RAIL|cajole quickly furiously ir
450528|7492|F|238942.06|1994-12-27|5-LOW|Clerk#000000503|0|arefully. dinos wake caref|450528|14309|838|2|33.00|40368.90|0.04|0.07|R|F|1995-01-21|1995-02-04|1995-02-20|COLLECT COD|AIR|s the even instructions. furiously s
450660|1498|F|57687.90|1995-03-04|4-NOT SPECIFIED|Clerk#000000827|0|ic accounts can haggle furiously bold dependencies. carefully fin|450660|17522|57|1|11.00|15834.72|0.03|0.04|A|F|1995-04-19|1995-04-21|1995-05-15|COLLECT COD|RAIL| could have to lose slyly even 
450695|4018|O|69146.08|1995-06-17|4-NOT SPECIFIED|Clerk#000000268|0|ly deposits about the fluffily final acco|450695|14260|53|1|6.00|7045.56|0.03|0.06|N|O|1995-07-16|1995-07-17|1995-08-10|TAKE BACK RETURN|AIR|across the stealthily
450726|12493|F|351694.37|1994-12-02|3-MEDIUM|Clerk#000000728|0|gle slyly fluffily unusual accounts. blithe d|450726|3311|818|2|37.00|44929.47|0.03|0.06|R|F|1995-02-01|1995-02-13|1995-02-18|NONE|AIR|ring foxes after th
450726|12493|F|351694.37|1994-12-02|3-MEDIUM|Clerk#000000728|0|gle slyly fluffily unusual accounts. blithe d|450726|8664|181|6|48.00|75487.68|0.08|0.03|R|F|1995-02-24|1995-02-25|1995-03-11|DELIVER IN PERSON|AIR|al, regular packa
450785|11332|O|223752.80|1995-10-02|3-MEDIUM|Clerk#000000444|0| after the foxes. furiously regular instructions wake n|450785|14213|742|2|48.00|54106.08|0.01|0.04|N|O|1995-10-14|1995-11-05|1995-11-09|DELIVER IN PERSON|AIR|silent asymp
450785|11332|O|223752.80|1995-10-02|3-MEDIUM|Clerk#000000444|0| after the foxes. furiously regular instructions wake n|450785|14478|479|5|22.00|30634.34|0.06|0.03|N|O|1995-12-02|1995-12-06|1995-12-08|TAKE BACK RETURN|RAIL|carefully ironic foxes wake
450822|13246|F|183540.85|1994-12-04|5-LOW|Clerk#000000555|0|lar instructions. doggedly ironic pinto bea|450822|7757|272|1|40.00|66590.00|0.07|0.01|A|F|1995-02-04|1995-02-16|1995-02-24|TAKE BACK RETURN|RAIL|ss instructions. regular 
451044|7555|F|154836.98|1994-10-25|3-MEDIUM|Clerk#000000929|0|ily ironic excuses. carefully reg|451044|18851|852|6|15.00|26547.75|0.06|0.04|R|F|1994-12-23|1995-01-11|1995-01-14|DELIVER IN PERSON|AIR|kly regular deposits
451137|14869|F|186337.43|1994-12-01|1-URGENT|Clerk#000000959|0|e slyly silent courts. packages cajole c|451137|10738|739|2|16.00|26379.68|0.08|0.01|R|F|1995-01-05|1995-01-13|1995-02-02|NONE|AIR|g requests after th
451137|14869|F|186337.43|1994-12-01|1-URGENT|Clerk#000000959|0|e slyly silent courts. packages cajole c|451137|12516|303|5|5.00|7142.55|0.07|0.06|A|F|1995-02-08|1995-02-20|1995-03-05|NONE|AIR|fully final deposits af
451425|6920|F|61884.07|1995-04-08|3-MEDIUM|Clerk#000000322|0|ts? regular, bold grouches wake fluffily. regular acco|451425|19379|187|2|31.00|40249.47|0.06|0.00|N|F|1995-05-23|1995-06-03|1995-06-21|DELIVER IN PERSON|RAIL|ep. even packages are q
451428|5000|F|132510.03|1995-01-07|1-URGENT|Clerk#000000704|0|. silently regular instructions wake fluffily slyly busy requests-- |451428|17400|668|2|5.00|6587.00|0.05|0.02|R|F|1995-03-04|1995-03-11|1995-03-16|COLLECT COD|AIR| wake fina
451523|4337|F|198488.53|1995-03-18|1-URGENT|Clerk#000000503|0|along the accounts. unusual instructions about the pending, regular acco|451523|6494|263|6|18.00|25208.82|0.10|0.03|R|F|1995-04-19|1995-05-03|1995-05-08|TAKE BACK RETURN|RAIL|y above the s
451619|13666|F|81884.43|1994-11-22|2-HIGH|Clerk#000000955|0| are. quickly final accounts along the requests nag furiou|451619|3971|731|1|47.00|88123.59|0.08|0.01|R|F|1995-01-24|1995-02-13|1995-02-21|DELIVER IN PERSON|RAIL|ely ironic theodolites slee
451748|3841|F|297968.10|1994-11-04|3-MEDIUM|Clerk#000000914|0|carefully even dependencies sleep. regular requests sleep |451748|13609|610|2|28.00|42632.80|0.05|0.08|A|F|1994-12-25|1995-01-03|1995-01-07|COLLECT COD|AIR|hang furiously. fl
451847|5506|F|276659.42|1995-01-19|3-MEDIUM|Clerk#000000638|0|ss requests along the furiously regular foxes breach carefully |451847|390|141|3|1.00|1290.39|0.10|0.04|R|F|1995-02-20|1995-03-11|1995-03-18|TAKE BACK RETURN|AIR|ain fluffily against the final theo
452037|5944|O|136077.70|1995-09-12|4-NOT SPECIFIED|Clerk#000000073|0|quickly. furiously even in|452037|15605|871|1|37.00|56262.20|0.06|0.02|N|O|1995-10-20|1995-10-24|1995-11-12|COLLECT COD|RAIL|deas. carefull
452097|14737|O|256206.07|1995-06-30|5-LOW|Clerk#000000396|0|ronic pinto beans. furiousl|452097|13249|513|2|2.00|2324.48|0.06|0.07|N|O|1995-09-15|1995-09-16|1995-10-04|DELIVER IN PERSON|RAIL|ole fluffily according to the quic
452642|8605|O|324217.09|1995-09-28|5-LOW|Clerk#000000354|0| foxes cajole slyly quickly special requests. blithely final reque|452642|17|768|7|10.00|9170.10|0.02|0.02|N|O|1995-10-28|1995-10-30|1995-11-03|NONE|AIR|e deposits lo
452806|4936|O|147179.63|1995-09-04|2-HIGH|Clerk#000000786|0|cuses thrash furiously slyly express theodolites. furiously |452806|1836|88|3|20.00|34756.60|0.10|0.05|N|O|1995-11-02|1995-11-03|1995-11-15|TAKE BACK RETURN|AIR|ng the regular, regular theodolites. slyl
453126|1918|P|265144.63|1995-03-21|2-HIGH|Clerk#000000904|0|e quickly regular packages. furiously special instructions sleep a|453126|1916|670|5|50.00|90895.50|0.10|0.04|A|F|1995-04-28|1995-05-05|1995-05-23|NONE|RAIL|ns haggle blithely alongside of the ironic 
453409|8239|F|39905.76|1995-02-26|5-LOW|Clerk#000000840|0|ep furiously across the dolphins. carefully express ideas are slyly. foxes|453409|2332|585|2|10.00|12343.30|0.08|0.00|N|F|1995-05-23|1995-05-25|1995-06-22|COLLECT COD|AIR|nts. even, special requests detect
453445|11777|F|164465.99|1995-01-24|3-MEDIUM|Clerk#000000775|0|ndencies are? furiously regular deposits use quickly pendi|453445|7159|931|4|33.00|35182.95|0.10|0.06|A|F|1995-03-25|1995-04-04|1995-04-05|COLLECT COD|AIR|structions wake furiously f
453765|3287|O|92733.51|1995-09-17|2-HIGH|Clerk#000000013|0| silent asymptotes about the blithely special requests wa|453765|1399|902|2|10.00|13003.90|0.06|0.03|N|O|1995-11-08|1995-11-13|1995-11-21|DELIVER IN PERSON|RAIL|regular realm
453923|7847|O|354617.49|1995-06-23|1-URGENT|Clerk#000000293|0|ose slyly along the furiously ironic packages. carefully silent instructions c|453923|19112|113|7|48.00|49493.28|0.02|0.07|N|O|1995-08-13|1995-08-23|1995-09-04|DELIVER IN PERSON|RAIL|s detect slyly: packag
454498|13090|P|260394.72|1995-04-04|3-MEDIUM|Clerk#000000354|0| foxes. blithely final foxes print furiously among the silent instructions. |454498|3658|912|5|45.00|70274.25|0.08|0.00|R|F|1995-05-07|1995-05-26|1995-05-30|COLLECT COD|AIR|ole. pending packages
454565|5510|O|225417.25|1995-06-02|5-LOW|Clerk#000000495|0|regular instructions. quickly final pinto beans about the blithe|454565|1923|175|1|37.00|67522.04|0.06|0.05|N|O|1995-07-08|1995-07-21|1995-08-06|DELIVER IN PERSON|AIR|. slyly pending deposits x
454566|2662|F|194528.10|1994-12-13|1-URGENT|Clerk#000000319|0|s haggle. unusual accounts play unusual grouches. slyly reg|454566|9274|275|3|11.00|13015.97|0.02|0.05|A|F|1995-01-17|1995-01-25|1995-02-08|NONE|AIR|es x-ray quickly among the furiously expres
454976|10685|P|140100.24|1995-04-19|3-MEDIUM|Clerk#000000968|0|s lose blithely. regul|454976|2921|174|1|29.00|52893.68|0.06|0.04|N|O|1995-06-21|1995-07-02|1995-07-21|COLLECT COD|RAIL|yly pending platelets sleep never i
455106|14903|O|92074.60|1995-09-20|5-LOW|Clerk#000000984|0|l requests. carefully ironic deposits thrash slyly about t|455106|14596|597|3|4.00|6042.36|0.03|0.08|N|O|1995-11-21|1995-11-23|1995-12-14|NONE|AIR|ajole carefully quickly quiet sheave
455111|980|O|113962.49|1995-06-01|1-URGENT|Clerk#000000239|0|nic excuses boost slyly regular ideas. furiously regu|455111|11711|973|3|18.00|29208.78|0.02|0.03|N|O|1995-06-27|1995-07-01|1995-07-27|DELIVER IN PERSON|RAIL|ronic ideas cajole bl
455361|6538|O|228575.02|1995-10-07|3-MEDIUM|Clerk#000000302|0|ackages. slyly regula|455361|18572|109|1|29.00|43226.53|0.08|0.00|N|O|1995-12-13|1995-12-18|1995-12-28|TAKE BACK RETURN|RAIL| deposits wake.
455361|6538|O|228575.02|1995-10-07|3-MEDIUM|Clerk#000000302|0|ackages. slyly regula|455361|9791|569|3|49.00|83338.71|0.10|0.06|N|O|1995-12-24|1996-01-04|1996-01-08|COLLECT COD|AIR|final requests. qu
455489|9575|P|325665.88|1995-04-08|3-MEDIUM|Clerk#000000982|0|pending accounts! regular warhorses along the furiously bo|455489|16591|124|5|3.00|4522.77|0.08|0.05|N|F|1995-06-17|1995-06-22|1995-07-08|DELIVER IN PERSON|RAIL|ly idle excus
455555|14191|F|134398.26|1994-11-27|5-LOW|Clerk#000000607|0| final instructions. ironic accounts could have to sleep blithely amo|455555|9727|987|1|38.00|62195.36|0.02|0.04|R|F|1995-01-14|1995-01-27|1995-02-04|TAKE BACK RETURN|AIR|ts wake pending ideas. final accoun
456001|14293|P|141287.00|1995-04-24|2-HIGH|Clerk#000000204|0|ial packages-- fluffily special instructions|456001|2232|989|1|9.00|10208.07|0.03|0.07|R|F|1995-05-19|1995-05-29|1995-06-09|TAKE BACK RETURN|RAIL|ly deposits. furiously regular courts a
456036|11372|F|286592.25|1994-10-12|1-URGENT|Clerk#000000493|0| silent requests use. |456036|13402|403|4|31.00|40777.40|0.09|0.07|A|F|1994-12-07|1994-12-22|1995-01-03|NONE|RAIL|uriously ironic foxes 
456038|7847|O|8125.81|1995-10-31|1-URGENT|Clerk#000000057|0|t the slyly ironic ideas. carefully special deposi|456038|3189|949|1|8.00|8737.44|0.07|0.00|N|O|1995-12-14|1995-12-21|1995-12-27|TAKE BACK RETURN|AIR|egular requests; ironic, regular foxes 
456097|3124|F|280275.55|1995-03-25|2-HIGH|Clerk#000000659|0|iously ironic packages sleep about the slyly quick asymptotes. pending pea|456097|11973|235|6|2.00|3769.94|0.04|0.03|N|F|1995-06-02|1995-06-19|1995-06-22|COLLECT COD|AIR|ounts sublate about t
456385|6523|F|236024.27|1994-12-30|4-NOT SPECIFIED|Clerk#000000442|0|ully express ideas. bold instructions boost after the slyly ironi|456385|12307|94|2|45.00|54868.50|0.09|0.00|R|F|1995-02-04|1995-02-09|1995-03-02|TAKE BACK RETURN|RAIL|accounts cajole slyly unusual deposi
456481|5323|O|259970.16|1995-10-23|1-URGENT|Clerk#000000467|0|xpress accounts print about the fluffily regular requests. quickly|456481|16456|255|5|1.00|1372.45|0.06|0.02|N|O|1995-12-12|1995-12-20|1996-01-01|TAKE BACK RETURN|RAIL|ously. regular packages thrash a
456519|12256|O|166446.36|1995-06-04|1-URGENT|Clerk#000000526|0|deposits. packages nag. e|456519|15260|261|1|45.00|52886.70|0.06|0.02|N|O|1995-08-09|1995-08-12|1995-08-18|NONE|AIR|haggle. fluffi
457029|14956|F|167821.51|1995-01-05|1-URGENT|Clerk#000000111|0|ar deposits are furio|457029|13020|284|7|24.00|22392.48|0.09|0.03|A|F|1995-01-27|1995-02-05|1995-02-22|COLLECT COD|AIR|s across the sl
457442|2875|P|124456.03|1995-05-18|5-LOW|Clerk#000000007|0|accounts x-ray. carefully express instructions alongside of th|457442|18162|967|2|12.00|12961.92|0.01|0.03|N|O|1995-07-20|1995-07-31|1995-08-15|NONE|RAIL|t requests. slyly unusual instructions
457446|11384|O|47583.18|1995-06-25|1-URGENT|Clerk#000000624|0| platelets according to the ironic braids might u|457446|14291|84|2|23.00|27721.67|0.04|0.00|N|O|1995-07-28|1995-08-17|1995-08-26|DELIVER IN PERSON|RAIL|es. ironically ironic p
457541|5797|P|254424.49|1995-03-08|2-HIGH|Clerk#000000169|0|riously above the ironic packages; si|457541|2684|685|7|38.00|60293.84|0.09|0.03|R|F|1995-04-19|1995-04-29|1995-05-08|DELIVER IN PERSON|RAIL| carefully pending pinto 
457637|1945|F|177659.81|1994-12-05|5-LOW|Clerk#000000719|0|fter the final escapades nag fluffily final foxes? pen|457637|2132|637|4|9.00|9307.17|0.09|0.08|A|F|1995-02-18|1995-02-23|1995-03-19|TAKE BACK RETURN|AIR| wake. quickly idle theodolites sleep
457637|1945|F|177659.81|1994-12-05|5-LOW|Clerk#000000719|0|fter the final escapades nag fluffily final foxes? pen|457637|17334|869|7|13.00|16267.29|0.02|0.07|R|F|1995-02-16|1995-03-02|1995-03-04|COLLECT COD|AIR|sts cajole quickly about the platelets
457827|3500|F|9357.72|1995-04-29|4-NOT SPECIFIED|Clerk#000000768|0|regular, special deposits. furiously unusual accounts cajole through th|457827|7403|661|2|3.00|3931.20|0.03|0.07|N|F|1995-06-07|1995-06-08|1995-06-29|COLLECT COD|RAIL|refully final theod
457831|271|F|127207.71|1994-12-09|1-URGENT|Clerk#000000788|0|lyly slow theodolites cajole. furiously final acco|457831|4867|868|1|31.00|54927.66|0.02|0.06|A|F|1995-01-21|1995-01-22|1995-02-15|TAKE BACK RETURN|AIR|quests haggle quickly 
457922|12862|F|99009.97|1994-12-27|3-MEDIUM|Clerk#000000559|0|oze quickly. slyly furious requests slee|457922|4128|637|4|28.00|28899.36|0.08|0.05|A|F|1995-01-28|1995-02-17|1995-02-18|NONE|RAIL|he slyly bold ideas wake fu
459009|11215|F|310407.64|1994-12-26|3-MEDIUM|Clerk#000000119|0|ccounts use. ironic, bold accounts sleep. slyly unusual dependencies across t|459009|11874|658|6|50.00|89293.50|0.05|0.00|R|F|1995-02-15|1995-02-22|1995-03-15|DELIVER IN PERSON|AIR|sts. blithely sil
459015|8711|P|192000.76|1995-05-25|4-NOT SPECIFIED|Clerk#000000283|0|fily regular asymptotes alongside of the blithely final pinto beans are blithe|459015|12110|635|4|33.00|33729.63|0.01|0.01|N|O|1995-06-22|1995-07-09|1995-07-12|COLLECT COD|RAIL|cies wake slyly. deposits use
459175|11092|O|17155.09|1995-12-09|5-LOW|Clerk#000000803|0|lyly ironic pinto beans boost slyly. slyly regular accounts hagg|459175|19283|91|1|14.00|16831.92|0.02|0.04|N|O|1995-12-25|1996-01-15|1996-01-17|NONE|AIR|eep slyly asy
459301|2968|O|176886.78|1995-10-09|1-URGENT|Clerk#000000506|0|regular, express deposits eat |459301|6386|387|2|12.00|15508.56|0.02|0.00|N|O|1995-11-13|1995-11-22|1995-12-04|TAKE BACK RETURN|RAIL|he blithely regular accounts. theod
459394|3628|F|6824.77|1995-01-11|2-HIGH|Clerk#000000034|0|y among the bold packages. ironic, regular pinto bea|459394|11440|702|1|5.00|6757.20|0.00|0.01|R|F|1995-03-02|1995-03-06|1995-03-15|COLLECT COD|RAIL|carefully whithout the carefully special 
459653|1774|F|187976.40|1995-02-15|1-URGENT|Clerk#000000312|0|sly. slyly regular packages snooze bef|459653|8353|128|1|39.00|49192.65|0.05|0.02|R|F|1995-04-08|1995-04-16|1995-05-05|TAKE BACK RETURN|AIR| quickly pending
459653|1774|F|187976.40|1995-02-15|1-URGENT|Clerk#000000312|0|sly. slyly regular packages snooze bef|459653|14965|758|7|3.00|5639.88|0.05|0.01|R|F|1995-03-10|1995-03-27|1995-04-08|NONE|AIR| packages among the f
459682|6248|O|258492.28|1995-07-29|3-MEDIUM|Clerk#000000778|0|al accounts. carefully express theodolites hagg|459682|307|58|1|45.00|54328.50|0.02|0.00|N|O|1995-10-12|1995-10-21|1995-10-23|TAKE BACK RETURN|AIR|r the express, even foxes h
460101|4081|O|182580.92|1995-07-17|5-LOW|Clerk#000000942|0|y stealthily silent accounts. carefully pending requ|460101|3645|405|4|24.00|37167.36|0.09|0.00|N|O|1995-08-10|1995-08-25|1995-08-28|TAKE BACK RETURN|RAIL|y slyly final foxe
460295|14017|O|304082.30|1995-09-15|3-MEDIUM|Clerk#000000043|0| special requests sleep blithely about the bold deposits. express, ironic inst|460295|15198|464|4|17.00|18924.23|0.00|0.06|N|O|1995-10-07|1995-10-21|1995-10-27|NONE|RAIL|uriously regular deposits. regular pinto b
460486|10966|F|264812.26|1995-02-28|2-HIGH|Clerk#000000563|0|s. furiously regular deposits wake slyly after|460486|2556|313|5|11.00|16044.05|0.02|0.08|A|F|1995-04-26|1995-05-04|1995-05-14|COLLECT COD|AIR| beans sleep special instruc
460547|2614|P|153808.35|1995-04-10|5-LOW|Clerk#000000901|0|detect carefully. slyly special instructions haggle quickly about the |460547|12090|877|1|17.00|17035.53|0.01|0.07|N|F|1995-06-14|1995-06-18|1995-06-29|DELIVER IN PERSON|RAIL|ickly after the blithely silent 
460678|13612|F|134145.99|1994-12-09|3-MEDIUM|Clerk#000000046|0|y special instructions are carefully according to the slyly ev|460678|12111|374|4|17.00|17392.87|0.08|0.01|R|F|1995-01-19|1995-02-03|1995-02-12|NONE|AIR|ording to the ruthlessly ironic
