o_orderkey|o_custkey|o_orderstatus|o_totalprice|o_orderdate|o_orderpriority|o_clerk|o_shippriority|o_comment|l_orderkey|l_partkey|l_suppkey|l_linenumber|l_quantity|l_extendedprice|l_discount|l_tax|l_returnflag|l_linestatus|l_shipdate|l_commitdate|l_receiptdate|l_shipinstruct|l_shipmode|l_comment
158658|3113|O|203058.29|1995-11-11|5-LOW|Clerk#000000219|0|the slyly ironic requests. slyly bold accounts wake ironic|158658|4625|626|1|42.00|64244.04|0.05|0.00|N|O|1995-12-21|1995-12-25|1996-01-11|NONE|AIR|ounts. slyly regular accounts a
158787|190|O|222545.62|1995-09-22|5-LOW|Clerk#000000340|0| packages detect slyly special requests. accounts haggle slyly|158787|13515|779|3|36.00|51426.36|0.04|0.06|N|O|1995-11-15|1995-11-20|1995-12-04|COLLECT COD|RAIL|ingly express packages. 
158790|3874|O|143602.94|1995-11-07|3-MEDIUM|Clerk#000000408|0|counts believe furiously. quickly ev|158790|4193|956|3|39.00|42790.41|0.05|0.08|N|O|1995-12-30|1996-01-15|1996-01-19|NONE|RAIL|y unusual courts: carefully 
158978|10387|F|107635.30|1994-12-21|1-URGENT|Clerk#000000658|0| ironic platelets. furiously pending sheaves haggle around|158978|2238|239|1|37.00|42188.51|0.10|0.00|R|F|1995-02-03|1995-02-04|1995-02-05|TAKE BACK RETURN|AIR|pecial deposits breac
159362|3898|F|173498.01|1995-02-28|1-URGENT|Clerk#000000676|0|refully. fluffily pending frays against the even accounts cajole |159362|4959|722|3|12.00|22367.40|0.08|0.05|A|F|1995-04-03|1995-04-12|1995-04-30|DELIVER IN PERSON|AIR|long the carefully blithe request
159491|6007|F|192824.92|1995-02-09|3-MEDIUM|Clerk#000000393|0|arefully even accounts. thinly ironic foxes nod furiously|159491|7711|712|6|7.00|11330.97|0.02|0.06|R|F|1995-04-17|1995-05-02|1995-05-04|TAKE BACK RETURN|AIR|ntiments. deposits above t
159588|1879|F|186489.44|1994-11-22|1-URGENT|Clerk#000000653|0|iously against the qui|159588|8604|379|5|49.00|74117.40|0.08|0.08|R|F|1995-01-28|1995-01-30|1995-02-18|DELIVER IN PERSON|RAIL|slyly regular courts haggle carefully stea
159683|2500|P|90238.96|1995-04-18|3-MEDIUM|Clerk#000000098|0|ely express requests-- bold,|159683|10765|546|2|22.00|36866.72|0.10|0.00|N|F|1995-06-07|1995-06-13|1995-06-25|DELIVER IN PERSON|AIR|ously bold requests. slyly pending 
159810|3766|F|177093.89|1995-01-09|4-NOT SPECIFIED|Clerk#000000065|0|regular accounts promise furiously furiously regular foxes. quickly spe|159810|17294|829|1|43.00|52085.47|0.02|0.06|R|F|1995-01-28|1995-02-10|1995-02-12|COLLECT COD|AIR|iously slow i
159938|7511|O|86756.67|1995-12-10|3-MEDIUM|Clerk#000000416|0|arefully regular pains. quic|159938|9271|272|5|24.00|28326.48|0.03|0.07|N|O|1995-12-26|1996-01-11|1996-01-17|TAKE BACK RETURN|AIR|as wake fluffily ironic plat
160001|6970|O|206065.79|1995-08-03|1-URGENT|Clerk#000000609|0|atelets are furiously slyly|160001|8433|692|3|1.00|1341.43|0.10|0.04|N|O|1995-09-08|1995-09-12|1995-09-27|TAKE BACK RETURN|RAIL|beans. bli
160295|373|F|133870.74|1995-01-02|3-MEDIUM|Clerk#000000591|0|d accounts. regular platelets haggle. furiously even theodolites boost.|160295|11184|707|4|38.00|41616.84|0.02|0.02|R|F|1995-03-17|1995-03-19|1995-04-11|NONE|RAIL| ideas nag furiously. special foxes 
160582|2644|F|147684.65|1995-01-14|3-MEDIUM|Clerk#000000605|0|quests cajole slyly alway|160582|8908|909|1|37.00|67225.30|0.06|0.03|R|F|1995-02-27|1995-03-10|1995-03-15|TAKE BACK RETURN|RAIL| regular deposits affix slyly a
161029|1889|O|130262.35|1995-08-02|3-MEDIUM|Clerk#000000903|0|nt requests wake furiously regular, regular deposits. final acc|161029|10078|859|1|18.00|17785.26|0.05|0.05|N|O|1995-09-26|1995-10-01|1995-10-20|TAKE BACK RETURN|RAIL| are slyly alongside of the bold, regula
161120|14780|O|78929.63|1995-11-09|5-LOW|Clerk#000000599|0|ges across the quietly special deposits haggle|161120|1979|482|1|42.00|79000.74|0.03|0.03|N|O|1995-12-31|1996-01-14|1996-01-18|DELIVER IN PERSON|RAIL|ar multipliers. sly
161252|9878|P|286318.39|1995-02-24|3-MEDIUM|Clerk#000000419|0|telets. blithely brave packages wake blithely furiously special asymptotes. i|161252|12005|268|5|36.00|33012.00|0.08|0.05|R|F|1995-04-21|1995-04-29|1995-05-21|TAKE BACK RETURN|RAIL| sleep blithely final asymptotes. pending f
161282|4232|O|52329.97|1995-05-24|1-URGENT|Clerk#000000873|0|ly regular foxes across the blithely final accounts use blithely unusual depo|161282|16784|583|1|19.00|32314.82|0.05|0.08|N|O|1995-07-11|1995-08-09|1995-08-10|NONE|AIR|es integrate carefully slyl
161408|10084|F|60814.63|1994-11-01|3-MEDIUM|Clerk#000000570|0|equests thrash blithely final deposits. slyly regular requests sleep care|161408|18364|365|1|48.00|61553.28|0.05|0.04|A|F|1995-01-15|1995-01-20|1995-01-21|NONE|RAIL|ular theodolites. blithely b
161538|9106|P|207157.70|1995-03-13|3-MEDIUM|Clerk#000000830|0|en theodolites. blithely regular foxes along the silent deposits haggle|161538|13396|923|1|34.00|44519.26|0.07|0.00|R|F|1995-04-18|1995-04-24|1995-05-07|NONE|RAIL|hely even foxes. blithely daring depo
162210|6085|O|159193.02|1995-10-05|4-NOT SPECIFIED|Clerk#000000531|0|re above the silent, even instructions. slyly |162210|5068|579|1|17.00|16542.02|0.10|0.05|N|O|1995-12-19|1995-12-26|1996-01-15|TAKE BACK RETURN|AIR| dinos cajole along the s
162274|11684|O|135101.47|1995-10-09|1-URGENT|Clerk#000000716|0|mptotes. quick, silent ideas are among the|162274|13888|152|6|5.00|9009.40|0.05|0.05|N|O|1995-11-08|1995-11-13|1995-11-25|DELIVER IN PERSON|AIR|along the s
162436|76|F|119897.53|1994-12-26|1-URGENT|Clerk#000000087|0|to beans wake fluffily about the silent foxes. re|162436|9480|999|2|22.00|30568.56|0.04|0.02|R|F|1995-01-16|1995-01-30|1995-02-12|NONE|RAIL|hould run among the fina
162436|76|F|119897.53|1994-12-26|1-URGENT|Clerk#000000087|0|to beans wake fluffily about the silent foxes. re|162436|12268|269|4|17.00|20064.42|0.05|0.03|R|F|1995-02-23|1995-03-08|1995-03-12|DELIVER IN PERSON|AIR|usly special ac
162754|9968|O|247168.97|1995-06-13|4-NOT SPECIFIED|Clerk#000000689|0| fluffily ironic deposits. blithely unusual packages x-ray quickly. final r|162754|8399|400|6|47.00|61447.33|0.05|0.07|N|O|1995-08-14|1995-08-21|1995-08-26|NONE|AIR| sleep carefully idle packages. blithely
162852|9251|P|165874.89|1995-05-30|5-LOW|Clerk#000000320|0|n ideas are above the silent, final accounts. pending de|162852|13421|211|1|19.00|25353.98|0.06|0.05|N|O|1995-06-30|1995-07-11|1995-07-24|NONE|RAIL|refully ironic escapa
162852|9251|P|165874.89|1995-05-30|5-LOW|Clerk#000000320|0|n ideas are above the silent, final accounts. pending de|162852|19852|122|5|18.00|31893.30|0.07|0.07|N|O|1995-07-16|1995-07-17|1995-08-01|COLLECT COD|AIR|y special foxes. enticingly 
162949|883|F|95849.84|1994-11-19|4-NOT SPECIFIED|Clerk#000000101|0|pinto beans ought to cajole. slyly slow frays cajole fur|162949|415|666|2|50.00|65770.50|0.07|0.06|A|F|1995-01-13|1995-01-14|1995-01-31|TAKE BACK RETURN|AIR|ind quickly regular accou
162977|13678|F|129508.00|1995-02-17|3-MEDIUM|Clerk#000000075|0|lets believe. furiously regular packages |162977|5757|268|1|49.00|81474.75|0.04|0.06|R|F|1995-03-13|1995-03-19|1995-04-05|COLLECT COD|RAIL|sleep slyly according to t
162980|6694|F|197878.61|1994-12-20|1-URGENT|Clerk#000000473|0|. carefully regular|162980|19900|170|1|15.00|27298.50|0.10|0.05|A|F|1995-01-16|1995-01-31|1995-02-09|NONE|RAIL|accounts. carefully pending dol
163331|8891|O|159224.29|1995-11-19|3-MEDIUM|Clerk#000000483|0|carefully express depend|163331|5449|450|1|8.00|10835.52|0.05|0.05|N|O|1995-12-25|1995-12-29|1996-01-24|COLLECT COD|AIR| according to t
163428|14548|P|185563.48|1995-05-23|3-MEDIUM|Clerk#000000576|0|cial foxes affix outside the ev|163428|8007|8|3|34.00|31110.00|0.06|0.04|N|O|1995-06-19|1995-07-03|1995-07-07|COLLECT COD|AIR|ic platelets. final dependen
163553|5552|O|359729.55|1995-08-01|5-LOW|Clerk#000000178|0|cial, ironic deposits in|163553|6487|256|5|33.00|45984.84|0.04|0.07|N|O|1995-08-29|1995-09-16|1995-09-24|DELIVER IN PERSON|RAIL|y. unusual, ironic foxes thrash
163682|8266|O|264245.07|1995-09-28|5-LOW|Clerk#000000597|0|xcuses affix against the slyly ironic pinto beans. furiously even reques|163682|8812|71|7|3.00|5162.43|0.01|0.07|N|O|1995-11-15|1995-12-07|1995-12-11|COLLECT COD|AIR|iously special dolphins; blithely even dep
163747|3130|P|148189.36|1995-04-07|2-HIGH|Clerk#000000070|0|ray carefully about the silent instructions. furiously final fox|163747|5068|834|5|27.00|26272.62|0.04|0.03|N|O|1995-06-24|1995-07-05|1995-07-22|NONE|AIR|usily regular excuses wake carefully
164167|823|F|197730.06|1995-02-10|3-MEDIUM|Clerk#000000536|0|s. furiously pending packages detect carefully final Tires|164167|17352|353|3|18.00|22848.30|0.03|0.08|A|F|1995-04-18|1995-04-29|1995-05-08|NONE|AIR|ans sleep. slyl
164514|1294|O|123567.63|1995-10-25|5-LOW|Clerk#000000798|0|ular packages-- fluffily final excuse|164514|13152|942|1|42.00|44736.30|0.09|0.06|N|O|1995-12-07|1995-12-14|1995-12-18|DELIVER IN PERSON|AIR|ss foxes cajole around the unusual fox
164514|1294|O|123567.63|1995-10-25|5-LOW|Clerk#000000798|0|ular packages-- fluffily final excuse|164514|4429|430|2|42.00|56003.64|0.02|0.00|N|O|1995-12-10|1995-12-21|1996-01-06|COLLECT COD|RAIL|ainst the bold ideas. blithely regu
164615|7315|F|117094.78|1994-10-27|5-LOW|Clerk#000000409|0| special deposits haggle quickly |164615|15238|239|4|46.00|53048.58|0.03|0.04|R|F|1995-01-02|1995-01-04|1995-01-10|TAKE BACK RETURN|RAIL|the carefully express accounts cajol
164706|13807|O|32535.51|1995-10-03|5-LOW|Clerk#000000715|0| around the blithely pending requests. furiousl|164706|562|563|1|23.00|33638.88|0.07|0.04|N|O|1995-11-20|1995-12-02|1995-12-04|NONE|RAIL|y final requests. even, 
164839|877|O|158223.79|1995-09-15|3-MEDIUM|Clerk#000000014|0|out the quickly dogg|164839|9427|946|5|46.00|61475.32|0.05|0.08|N|O|1995-10-10|1995-10-27|1995-11-07|TAKE BACK RETURN|AIR|have to sleep against the carefully e
164896|3175|F|136808.39|1995-02-08|5-LOW|Clerk#000000726|0|counts wake along the final requests. quick|164896|2770|527|3|26.00|43492.02|0.06|0.04|A|F|1995-03-13|1995-03-15|1995-04-11|NONE|AIR|kages haggle on t
165026|13199|P|226512.04|1995-05-10|2-HIGH|Clerk#000000883|0|eodolites. accounts wake ruthlessly. entic|165026|15761|27|2|28.00|46949.28|0.00|0.07|N|F|1995-06-03|1995-06-20|1995-07-03|DELIVER IN PERSON|AIR|p quickly stealthy, u
165475|8914|F|229057.66|1995-01-19|5-LOW|Clerk#000000061|0|iously ironic accounts cajole carefully against the ironic pinto beans. quickl|165475|14337|338|4|2.00|2502.66|0.05|0.00|R|F|1995-03-26|1995-04-05|1995-04-15|COLLECT COD|AIR| final accounts. blith
165476|10480|P|233375.02|1995-03-19|3-MEDIUM|Clerk#000000744|0|he regular, even excuses.|165476|15768|34|3|35.00|58931.60|0.06|0.02|A|F|1995-05-19|1995-05-24|1995-05-28|TAKE BACK RETURN|AIR|es along t
166086|946|O|129127.94|1995-07-17|4-NOT SPECIFIED|Clerk#000000411|0|blithely pending dec|166086|883|884|4|38.00|67787.44|0.02|0.08|N|O|1995-08-07|1995-08-24|1995-08-29|DELIVER IN PERSON|AIR|t quickly. special plat
166181|13367|P|221097.46|1995-04-01|4-NOT SPECIFIED|Clerk#000000198|0|ans cajole furiously carefully brave instructions: carefully ironic accou|166181|15901|432|1|50.00|90845.00|0.01|0.04|A|F|1995-05-28|1995-05-30|1995-06-07|NONE|AIR| regular theodolites
166307|4120|P|238193.35|1995-03-12|4-NOT SPECIFIED|Clerk#000000293|0|ackages integrate? carefully bold dependencies use ca|166307|5968|969|4|25.00|46849.00|0.04|0.06|A|F|1995-05-13|1995-05-23|1995-05-28|COLLECT COD|AIR|ccounts. carefully even pinto beans s
166438|5843|O|58740.45|1995-08-11|2-HIGH|Clerk#000000791|0|s nag final foxes. dependencies solve qui|166438|8542|59|2|35.00|50768.90|0.01|0.01|N|O|1995-09-27|1995-10-07|1995-10-19|NONE|RAIL|y after the carefully silent p
166951|6244|F|76088.77|1994-11-02|5-LOW|Clerk#000000876|0|unts sleep fluffily. packages haggle evenly along the slyly sly ideas. carefu|166951|9656|657|3|4.00|6262.60|0.08|0.06|R|F|1995-01-06|1995-01-22|1995-01-29|DELIVER IN PERSON|AIR|ely ironic deposits. foxes aft
167106|8641|F|139284.09|1995-02-02|3-MEDIUM|Clerk#000000242|0|sits haggle about the accounts. furiously final ex|167106|12877|140|2|6.00|10739.22|0.02|0.08|R|F|1995-03-23|1995-03-26|1995-04-03|COLLECT COD|RAIL| fluffily bold req
167330|5680|F|111261.68|1995-02-14|5-LOW|Clerk#000000034|0|equests. slyly ironic deposits boost about the qu|167330|13683|947|2|20.00|31933.60|0.08|0.00|A|F|1995-04-05|1995-04-14|1995-04-15|TAKE BACK RETURN|AIR|oxes may caj
167460|146|O|204361.89|1995-06-17|4-NOT SPECIFIED|Clerk#000000773|0|en, regular pinto beans sleep above the express pa|167460|1683|186|1|16.00|25354.88|0.10|0.03|N|O|1995-07-18|1995-08-07|1995-08-14|DELIVER IN PERSON|RAIL| around the slyly pendi
167619|9658|O|322913.90|1995-08-04|2-HIGH|Clerk#000000667|0|ites around the deposits breach furiously across the furiously even foxes. f|167619|5470|726|4|43.00|59145.21|0.03|0.01|N|O|1995-10-13|1995-10-17|1995-11-05|COLLECT COD|RAIL|special sentiments cajole across th
167651|6577|O|150708.85|1995-10-03|2-HIGH|Clerk#000000521|0|s wake among the ironic packages! slyly pending requests sleep. deposits |167651|13192|719|2|30.00|33155.70|0.06|0.06|N|O|1995-12-03|1995-12-05|1995-12-09|NONE|RAIL|olites according to the caref
167713|3005|F|158156.54|1994-12-10|4-NOT SPECIFIED|Clerk#000000982|0|. quickly bold pinto beans are furiously alongside of the final request|167713|5484|995|1|40.00|55579.20|0.03|0.04|R|F|1995-03-02|1995-03-10|1995-03-17|COLLECT COD|RAIL|above the final, final depos
167906|4714|O|219202.75|1995-09-05|2-HIGH|Clerk#000000088|0|es after the ironic d|167906|18455|456|5|17.00|23348.65|0.02|0.07|N|O|1995-11-13|1995-11-27|1995-12-11|DELIVER IN PERSON|AIR|al pinto beans. furiously bold
168069|14155|O|206606.19|1995-11-04|3-MEDIUM|Clerk#000000066|0|ost fluffily unusual pinto beans. |168069|12851|852|4|20.00|35277.00|0.01|0.08|N|O|1995-12-19|1996-01-09|1996-01-12|DELIVER IN PERSON|AIR|totes affix. carefu
168418|9692|F|49568.54|1994-12-16|4-NOT SPECIFIED|Clerk#000000652|0| silent dolphins sleep blithely. quickly unusual packages a|168418|3337|338|1|40.00|49613.20|0.03|0.03|R|F|1995-02-28|1995-03-04|1995-03-16|COLLECT COD|RAIL|nto beans. fox
168449|14452|F|261333.93|1995-02-08|4-NOT SPECIFIED|Clerk#000000331|0|packages for the silent dependenc|168449|12443|968|5|12.00|16265.28|0.08|0.08|R|F|1995-04-20|1995-05-04|1995-05-14|DELIVER IN PERSON|AIR|e pending, e
168579|11776|O|141224.52|1995-08-19|1-URGENT|Clerk#000000143|0|ic ideas nag quickly pa|168579|13263|53|2|36.00|42345.36|0.05|0.03|N|O|1995-10-01|1995-10-02|1995-10-21|DELIVER IN PERSON|AIR|kly final r
168608|376|F|203918.21|1995-02-15|3-MEDIUM|Clerk#000000803|0|s among the slyly even theodolites nag furiously u|168608|3453|707|3|25.00|33911.25|0.09|0.08|A|F|1995-03-01|1995-03-21|1995-03-23|COLLECT COD|RAIL| carefully. carefu
168742|1219|F|134115.66|1995-01-23|2-HIGH|Clerk#000000240|0|heaves. furiously iro|168742|2526|283|2|34.00|48569.68|0.10|0.01|R|F|1995-04-16|1995-04-23|1995-05-02|DELIVER IN PERSON|AIR|ckages are after the final
168838|7705|O|120699.24|1995-08-30|4-NOT SPECIFIED|Clerk#000000522|0|riously final deposits grow slyly. foxes play blithely against the regular |168838|10436|957|3|11.00|14810.73|0.06|0.07|N|O|1995-11-24|1995-11-27|1995-12-20|COLLECT COD|AIR|. blithely ironic reques
168993|3809|O|158906.88|1995-08-14|2-HIGH|Clerk#000000805|0|bold frets shall detect slyly|168993|3202|709|5|26.00|28735.20|0.09|0.02|N|O|1995-11-03|1995-11-09|1995-11-17|DELIVER IN PERSON|AIR|al theodolites. special pinto beans are
169283|7651|F|85001.70|1994-11-25|2-HIGH|Clerk#000000379|0|ly packages. blithely ironic patterns |169283|12405|930|2|35.00|46109.00|0.03|0.02|R|F|1995-01-21|1995-02-07|1995-02-19|DELIVER IN PERSON|AIR|nts sleep. final, final package
169349|8188|F|72515.94|1995-01-19|2-HIGH|Clerk#000000572|0|around the blithely regular requests. blithely iro|169349|14446|711|4|26.00|35371.44|0.08|0.03|R|F|1995-03-10|1995-03-22|1995-04-08|NONE|AIR|integrate furiously 
169411|6970|F|185524.10|1994-11-22|3-MEDIUM|Clerk#000000664|0|ns: requests wake above the slyly bo|169411|10525|306|2|36.00|51678.72|0.09|0.06|A|F|1995-01-14|1995-02-07|1995-02-13|NONE|RAIL|row furiously express braid
169572|11407|O|193782.65|1995-10-03|4-NOT SPECIFIED|Clerk#000000373|0|ic dugouts. bold instructions a|169572|14838|103|3|36.00|63101.88|0.09|0.06|N|O|1995-11-25|1995-11-29|1995-12-17|COLLECT COD|AIR|o beans sleep blithely above the furiousl
169604|4654|O|215430.75|1995-11-23|3-MEDIUM|Clerk#000000258|0|ost blithely across the |169604|5673|674|7|38.00|59989.46|0.07|0.07|N|O|1995-12-18|1996-01-05|1996-01-11|NONE|RAIL|rthogs wake slyly. theodolites use bl
169668|7571|F|353188.28|1995-01-12|2-HIGH|Clerk#000000730|0|thely instead of the unusual asymptote|169668|4288|543|7|25.00|29807.00|0.02|0.00|R|F|1995-02-16|1995-02-28|1995-03-07|DELIVER IN PERSON|RAIL|l, ironic deposits. 
169861|1981|O|262242.32|1995-06-14|5-LOW|Clerk#000000924|0|alongside of the accou|169861|7009|10|4|25.00|22900.00|0.06|0.00|N|O|1995-09-05|1995-09-11|1995-09-15|COLLECT COD|RAIL|ress accou
170054|9431|F|241825.43|1994-12-18|4-NOT SPECIFIED|Clerk#000000828|0|carefully ironic packages. eve|170054|14707|972|2|40.00|64868.00|0.08|0.01|R|F|1995-02-23|1995-02-27|1995-03-11|DELIVER IN PERSON|RAIL| blithely un
170087|10811|F|228438.70|1994-11-12|1-URGENT|Clerk#000000797|0|ly final packages. final deposits poach fluffily carefully final packages-- c|170087|7449|221|7|1.00|1356.44|0.02|0.04|R|F|1995-02-01|1995-02-10|1995-02-26|NONE|RAIL|ironic platelets wake. express gift
170435|6607|F|147977.27|1995-02-23|3-MEDIUM|Clerk#000000473|0| silent foxes affix slyly. entic|170435|19620|890|2|14.00|21554.68|0.01|0.04|R|F|1995-03-25|1995-04-08|1995-04-23|DELIVER IN PERSON|RAIL| carefully pending ideas. slyly pending the
170435|6607|F|147977.27|1995-02-23|3-MEDIUM|Clerk#000000473|0| silent foxes affix slyly. entic|170435|6131|132|3|37.00|38373.81|0.08|0.00|A|F|1995-05-05|1995-05-09|1995-05-20|TAKE BACK RETURN|AIR| hang furiously finally pending d
170630|13385|P|49125.28|1995-03-25|1-URGENT|Clerk#000000666|0|lly along the slyly ex|170630|5207|463|1|37.00|41151.40|0.06|0.04|N|F|1995-05-29|1995-06-11|1995-06-26|TAKE BACK RETURN|AIR|urts haggle blithely according to the slyl
170723|14387|F|174287.39|1994-10-02|1-URGENT|Clerk#000000758|0|eas affix. furiously express deposits are blithely even, special plate|170723|183|934|4|42.00|45493.56|0.10|0.02|A|F|1994-12-17|1994-12-28|1995-01-09|DELIVER IN PERSON|RAIL|ate quickly. slyly ir
171040|8278|O|136786.31|1995-08-31|3-MEDIUM|Clerk#000000347|0|against the regular packages boost slyly final accounts. regular accounts hag|171040|3262|22|3|13.00|15148.38|0.10|0.02|N|O|1995-11-10|1995-11-13|1995-11-27|TAKE BACK RETURN|RAIL|uffily careful reque
171269|1501|F|222930.02|1995-03-20|3-MEDIUM|Clerk#000000442|0|ng to the carefully final pin|171269|19806|76|3|30.00|51774.00|0.04|0.03|A|F|1995-05-08|1995-06-05|1995-06-07|TAKE BACK RETURN|AIR|e even theodoli
171297|5387|F|129317.78|1995-02-11|1-URGENT|Clerk#000000314|0|ly even platelets. carefully bold asymptotes haggle carefully. packages sle|171297|5138|394|2|4.00|4172.52|0.00|0.04|A|F|1995-03-27|1995-04-18|1995-04-24|TAKE BACK RETURN|RAIL|es nag according to the
171297|5387|F|129317.78|1995-02-11|1-URGENT|Clerk#000000314|0|ly even platelets. carefully bold asymptotes haggle carefully. packages sle|171297|1076|77|3|35.00|34197.45|0.10|0.06|R|F|1995-03-25|1995-03-29|1995-04-09|COLLECT COD|RAIL| special account
171398|12046|O|182781.26|1995-08-02|1-URGENT|Clerk#000000308|0|e to snooze fluffily against the furiously ironic waters. carefully regul|171398|16805|604|4|32.00|55097.60|0.06|0.05|N|O|1995-08-30|1995-09-08|1995-09-25|DELIVER IN PERSON|AIR| express, p
172035|2864|O|323256.83|1995-11-25|3-MEDIUM|Clerk#000000211|0|e accounts affix carefully regular requests. final escapades among the stealt|172035|17000|267|7|28.00|25676.00|0.08|0.05|N|O|1995-12-31|1996-01-15|1996-01-26|COLLECT COD|RAIL|ests engage thi
172261|7606|F|319458.32|1995-01-13|1-URGENT|Clerk#000000425|0|inos haggle quickly quic|172261|14449|242|6|44.00|59991.36|0.05|0.03|A|F|1995-03-04|1995-03-12|1995-03-28|NONE|AIR|uses sleep slyly ironic pin
172545|8585|P|114059.53|1995-03-29|3-MEDIUM|Clerk#000000362|0|packages cajole finally silent pint|172545|14973|974|2|6.00|11327.82|0.06|0.05|N|F|1995-05-22|1995-06-14|1995-06-18|NONE|RAIL|tect fluffily above the quickl
172547|6991|P|223030.92|1995-04-21|2-HIGH|Clerk#000000790|0|regular packages. requests use quickly blithely even packages. fur|172547|14668|197|5|41.00|64889.06|0.00|0.02|R|F|1995-05-25|1995-06-02|1995-06-10|TAKE BACK RETURN|RAIL|riously accounts. bravely bold a
172934|5839|F|177979.40|1994-12-02|1-URGENT|Clerk#000000840|0|yly ironic requests. slyly final packages wake slyly deposit|172934|18849|118|5|34.00|60106.56|0.09|0.08|R|F|1995-01-13|1995-01-15|1995-02-08|DELIVER IN PERSON|RAIL|ular dolphins. slyly pending req
173126|4096|F|284737.39|1994-12-25|5-LOW|Clerk#000000637|0|sly. fluffily special ideas among the |173126|7946|947|3|24.00|44494.56|0.10|0.03|A|F|1995-01-19|1995-02-06|1995-02-09|COLLECT COD|AIR|gged foxes are throughout th
173284|11656|F|249464.79|1994-10-14|2-HIGH|Clerk#000000461|0|ly express attainments. special accounts |173284|6185|698|5|36.00|39282.48|0.00|0.02|A|F|1995-01-03|1995-01-09|1995-01-15|NONE|AIR|ts wake regular dependencies. furio
173410|14170|F|230675.76|1994-11-19|3-MEDIUM|Clerk#000000172|0|ld deposits. accounts integrate never. furiously final courts wake c|173410|6720|977|1|10.00|16267.20|0.04|0.00|R|F|1995-01-09|1995-01-13|1995-01-16|TAKE BACK RETURN|AIR|ccounts sleep. re
173410|14170|F|230675.76|1994-11-19|3-MEDIUM|Clerk#000000172|0|ld deposits. accounts integrate never. furiously final courts wake c|173410|13525|315|4|50.00|71926.00|0.06|0.06|R|F|1994-12-26|1995-01-19|1995-01-25|TAKE BACK RETURN|RAIL|eans cajole furiously alongside of t
173537|13291|F|185936.68|1994-11-07|5-LOW|Clerk#000000061|0|e blithely final excuses.|173537|6083|852|1|45.00|44508.60|0.06|0.01|R|F|1995-01-21|1995-01-26|1995-02-01|TAKE BACK RETURN|RAIL|carefully even requests haggle across the f
173537|13291|F|185936.68|1994-11-07|5-LOW|Clerk#000000061|0|e blithely final excuses.|173537|4468|231|4|19.00|26076.74|0.00|0.00|R|F|1995-01-09|1995-01-16|1995-01-27|COLLECT COD|AIR|lets. quickly regular fo
173730|14614|O|164862.79|1995-06-23|4-NOT SPECIFIED|Clerk#000000637|0|ic accounts. furiously iro|173730|12960|961|2|39.00|73045.44|0.01|0.04|N|O|1995-09-18|1995-09-19|1995-10-04|NONE|RAIL| ideas. quickly regu
173730|14614|O|164862.79|1995-06-23|4-NOT SPECIFIED|Clerk#000000637|0|ic accounts. furiously iro|173730|16764|765|3|23.00|38657.48|0.07|0.06|N|O|1995-08-11|1995-08-17|1995-09-06|COLLECT COD|RAIL|c platelets wake slyly flu
174852|14614|P|216736.58|1995-05-20|3-MEDIUM|Clerk#000000046|0| platelets. instructions|174852|17170|438|4|17.00|18481.89|0.06|0.08|N|O|1995-07-14|1995-07-22|1995-08-02|TAKE BACK RETURN|AIR|he furiously regular pinto beans. 
175682|13816|O|162254.26|1995-09-25|5-LOW|Clerk#000000248|0| accounts. slyly even tithes un|175682|3235|489|4|14.00|15935.22|0.01|0.06|N|O|1995-10-16|1995-10-30|1995-11-12|TAKE BACK RETURN|AIR|ke fluffil
175936|8945|F|158157.48|1994-09-28|3-MEDIUM|Clerk#000000014|0|e. ironic, ironic courts against the ironic,|175936|19430|431|4|33.00|44531.19|0.08|0.01|R|F|1994-12-08|1994-12-11|1995-01-03|NONE|AIR| furiously under the care
176227|10430|F|173097.86|1995-04-02|5-LOW|Clerk#000000706|0|e. blithely bold deposits after the final waters sl|176227|261|512|3|9.00|10451.34|0.02|0.04|A|F|1995-05-22|1995-06-02|1995-06-09|TAKE BACK RETURN|RAIL|xpress pinto beans 
176263|14968|F|94952.70|1994-12-26|5-LOW|Clerk#000000838|0|tions. carefully stealthy pinto beans|176263|12938|201|1|50.00|92546.50|0.05|0.08|A|F|1995-01-31|1995-02-12|1995-02-27|TAKE BACK RETURN|RAIL|lets are fluffil
176359|7390|F|231535.62|1994-10-31|2-HIGH|Clerk#000000401|0| accounts. regular, blithe re|176359|13864|865|4|28.00|49780.08|0.07|0.08|A|F|1994-12-30|1995-01-04|1995-01-20|TAKE BACK RETURN|AIR|uriously final requests. final depo
176548|6418|F|39891.46|1994-12-07|5-LOW|Clerk#000000148|0|ing foxes. ironic, ironic pi|176548|3666|173|2|15.00|23544.90|0.06|0.03|R|F|1994-12-28|1995-01-16|1995-01-26|DELIVER IN PERSON|AIR|of the accounts? quickly iron
177255|6122|O|161260.33|1995-09-23|1-URGENT|Clerk#000000899|0| are fluffily bold requests! slyly iro|177255|16179|180|1|9.00|9856.53|0.02|0.04|N|O|1995-11-10|1995-11-28|1995-11-30|COLLECT COD|AIR|arefully express accounts. blithely eve
177313|7778|F|210775.84|1995-01-01|5-LOW|Clerk#000000636|0|s against the slyly regular foxes sleep slyly ironic theodolites. fluf|177313|5875|131|4|32.00|56987.84|0.08|0.01|R|F|1995-01-31|1995-02-01|1995-02-12|NONE|AIR|uriously unusual excuses are regular, unu
177444|2039|F|122590.81|1995-02-05|3-MEDIUM|Clerk#000000897|0|zle slyly. ironic, pending packages alongside of th|177444|5746|512|1|14.00|23124.36|0.05|0.06|R|F|1995-03-30|1995-03-31|1995-04-08|TAKE BACK RETURN|RAIL| accounts use near the blithely e
177606|11767|P|264952.69|1995-03-19|5-LOW|Clerk#000000412|0|ly furious packages. carefully pending braids are among the f|177606|2697|454|4|45.00|71986.05|0.10|0.02|R|F|1995-04-23|1995-05-02|1995-05-03|TAKE BACK RETURN|AIR| slow excuses sl
178624|12122|F|166696.51|1995-02-28|1-URGENT|Clerk#000000073|0| are against the car|178624|16921|720|1|42.00|77192.64|0.06|0.07|A|F|1995-04-29|1995-05-21|1995-05-26|COLLECT COD|RAIL|s. furiously pending req
178724|8375|F|164387.46|1995-01-09|3-MEDIUM|Clerk#000000652|0|ounts. blithely unusual theodolites use quickly. slyly final deposits haggl|178724|8308|567|5|6.00|7297.80|0.01|0.02|R|F|1995-04-06|1995-04-08|1995-04-11|DELIVER IN PERSON|AIR| Tiresias wake blithely iron
178820|12577|O|47101.40|1995-09-04|5-LOW|Clerk#000000480|0| blithely bold accounts. carefully fluffy excuses wake? ironic ideas wake |178820|17729|531|2|4.00|6586.88|0.10|0.06|N|O|1995-09-30|1995-10-04|1995-10-09|COLLECT COD|AIR|r notornis sleep furiously pen
